단어,포함된 문장
갓생,솔직히 썰플리 직찍들 보고도 마크 얼굴로 까는 사람들은 문제가 있다. 남을 어떻게든 깎아내리지 않으면 자기의 기분이 좋아지지 않는 루저들임. 마크 얼굴 어쩌구 악플달고 다닐 시간에 본진 덕질을 하거나 책을 한글자 더 읽어라.. 너희들이 열심히 부정하고 다녀도 마크의 갓생은 변하지 않고 본인들만 아~ 내가 추악한 인간입니다. 라고 인정하는 행위만 될 뿐. 천성이 선하고 나쁜 일은 커녕 조금의 잡음도 없는 어린애는 놔두자. 본진때문에 견제하느라 악플들 달고 다닐 시간에 경제 뉴스나 더 봐...
강구해,무식한 아저씨가 무심결에 여자를 멍하게 쳐다보고 있었다면 이유는 하나 뿐이지 아마도 꼴ㄹ 거임. 뭐 ㄲㄹ수야 있지만 절대 다수의 남자는 이 단계에서 제어해내기 때문에 범죄자가 되지 않는데 남의 집 창문을 대놓고 들여다볼 정도로 정신 나간 사람이라면 예외적 남자일 수가 있겠어 대책을 강구해야겠다.
개별루,근데 데뷔앨범아트 디자인 진짜 개별루다...
개인활동,예능감 위트 최고 누구보다 순발력 좋고 조곤조곤 말 잘하고 어떤 프로 나가도 개인활동 빛남
개충격,근데 쇼핑몰 말투 보니까 원래 저런 싸가지 없는? 그런 말투를 써서 그게 습관화되니까 아니 오전 7시겠냐구요 ㅜ 이런식으로 말이 나온거 같음 ㅋㅋ 답장 보고 네...? 이러는거 보니까 자기는 평소에도 쓰는 말투라 문제 없다고 생각하고 보냈는데 게으르다 이러니까 개충격 먹은 ㅇㅇ ㅋㅋㅋㅋㅋㅋ 문제는 친구 사이도 아니고 고객 응대하는 사람이 말투가 저렇고 문제라는걸 인지못한다는게 ㄹㅇ 충격임
고소후,반대 투명하누 고소한다니까 발작ㅋㅋㅋㅋㅋ  아이유는 현생 잘살고있는데 왜케 끌어내릴려고하냐 저 회사도 뒤늦게알고 고소하는거네 이담회사는 고소후통보인데 안봐줌
공동인증서,"남편과 결혼25년차고남편이 지방발령을 받아서 10년을 별거생활을 했어요주말부부가 아니고 별거라고 한 이유는지방발령받은직후 돈문제로 대판싸우고 남편이 집을 나가버렸어요그러면서 별거에 들어갔고 지방에서 근무하며 10년 별거생활을 했습니다.그때 큰아이가 15살 작은아이가 13살이었는데저는 전업주부였거든요그런데 남편이 매달 한달도 빼먹지 않고 10년을 꼬박꼬박 250만원씩 보내줘서 아이들을 키웠고 저도 중간중간 직장생활을 했습니다.그러다가 최근에 남편이 서울로 발령이 나서 자기본가(어머니계신집)로 가서 생활을 했는데 남편이 회사에서 큰사고를 쳐서 징계위원회가 열린겁니다.본인이 그런 큰일을 겪고 나니 몸도 마음도 힘들어져서 저희집으로 들어오게되었어요왜냐하면 회사가 저희집과 가까워서 운전하는데 덜 힘들어서 들어온거예요어머님집과는 회사가 1시간 이상 운전해야 하거든요.아무튼...그렇게 해서 지금 두달정도 같이 생활을 하고 있는데제가 아파트 청약을 넣어보려고 공동인증서좀 달라고 했더니 주더라고요그런데 생각지도 않게 공동인증서로 여러가지 정보가 다 나오는데그동안 모텔을 수시로 들락달락 거리고 작년 가을엔 1박2일로 강릉의 고급호텔을 얻어서 갔다온 기록도 있더라구요그래서 너무 의심스러워서 가방을 뒤져보게 되었는데 며칠전 가방에서 여자 스타킹이 나왔는데 성기부분과 항문부분을 동그랗게 일부러 찢어놓은 살색 스타킹이 나오더라구요  그걸 보는 순간 어찌나 충격이 크던지지금 남편에게는 아무말 안하고 있어요저는 이혼을 생각중이에요우리부부는 결혼하자마자 섹스리스였어요 두아이 모두 단 한번씩의 관계로 생긴 아이이고 그외에는 25년간 관계가 없었어요.저는 남편이 그래서 너무나 궁금하고 비밀이 뭔지 항상 궁금했어요정상적인 남자라면 저럴수있을까 싶어서요그런데 이번에 여러가지 모텔이나 스타킹을 보고나니 여자가 있는건지 , 아니면 성매매인건지여전히 모르겠지만 같이 살 사람은 아니구나 나를 너무 능멸했구나라는 생각에 이혼결심을 했어요 뭐 이제와서 이런거 따지는것도 무의미해보이시죠?그럴만큼 허탈 합니다.그런데 정말 궁금해요 남편의 정체가 뭘까요?  "
공수치, ㅋㅋㅋㅋ 아니 너네 너무 드라마 많이 본 듯..ㅋㅋ 예쁜여자 질투하고 시샘하는것도 이제 옛날말인데 ㅠ 요새는 예쁜여자 있으면 여자들이 더 친해지려고 하고 좋아함.. 공수치 오져ㅜ너네 제발 그만둬 ㅠ
공수치, 해프들아 유니버스 레귤러 잇티제 직캠보고 빠깍지좀 빼고와 이번 단체콘만 봐도 유타가 이해찬보다 노래 훨잘하던데 세기의 능력충 정치질 ㅈㄴ 공수치오노
굥정권,굥정권은 제대로 된 게 하나 없네요
국힘,간밤에 뜬 윤석열 녹취록 ㅋㅋㅋㅋ 지 입으로 국힘 뽀개버리겠댄다 ㅋㅋㅋ 2찍들 어뜩하냐? ㅋㅋㅋㅋ 
국힘,맨날 민주당 성범죄자 프레임 씌우다가 국힘당이나 윤석열은 찐으로 성범죄자편 들어주네
국힘,저런사람이 후보라는데 민주당 국힘당이 무슨 상관이냐 이 나라좀먹는 무지성 국힘 지지자들아. 나도 굳이 민주당 지지안하지만 저런자가 후보라는데 민주당이 왜나오냐. 쌍팔년도에도 친구들한테 자리 하나씩 주는건 안했을듯.
국힘,"제대로 찾아보지도 않고 또 민주당이 어쩌니 저쩌니.  진짜 답이 없고 이러니까 국힘같은 정당이 남아있는거다.  구하라법을 민주당 서영교 의원이 발의를 했고국회에 계류중인 이유가 기존 상속법 자체가 망가지는 리스크가 있어서 쉽사리통과를 못시키고 있는거다.  이런 하나하나 억울한 사례를 들어 법체계가 쉽게 바뀌면행정력이 어마어마하게 많이 드는 일이 발생을 하는거야.  그래서 시간이 걸리고 있고이재명이 반드시 통과를 시키겠다고 하고있는데 민주당이 어쩌니 ㅋㅋㅋ.자유민주주의 얘기하면서 국부를 이승만이라고 ㅋㅋ.  이승만 부정선거 독재하다가국민들에 의해 쫒겨났고, 박정희는 경제성장이라는 중요한 성과가 있지만자유민주주의와 완전 반대의 개념을 가진 사람이다.  헌법을 파괴시키고 유신헌법을새로만든 인간이 자유민주주의??  거기다 대통령 죽은 틈을 타서 군대 일으켜 쿠데타로 정권잡은 전두환, 그 전두환 친구 노태우, 또 거기에 붙은 김영삼의 뿌리를가진 국힘이 자유민주주의??  개가 웃겠다."
국힘,방탄에서 아버지가 국힘한테 와인받고 음치에 존못이고 문신 클럽 건보료 미납 부동산 투기하고도 욕 안먹는건 인기가 없어서야즉 뭔 짓을 해도 사람들이 ㅈㄴ 관심이 없단거고 결국에 지들이 팬도 많고 인기 있다고 주장하는 고릴라 무리들은 뷔 정국 화제성을 죽어도 못 넘음 실력도 마찬가지고ㅋㅋㅋㅋ하루종일 남 죽어라 까대는 니들이랑 니 최애는 꼭 불행해지길 바란다 정국이 까내린다고 니 최애가 절대 인기 많아지지 않음 오히려 팀 전체가 내려가지
국힘당,맨날 민주당 성범죄자 프레임 씌우다가 국힘당이나 윤석열은 찐으로 성범죄자편 들어주네
국힘당,저런사람이 후보라는데 민주당 국힘당이 무슨 상관이냐 이 나라좀먹는 무지성 국힘 지지자들아. 나도 굳이 민주당 지지안하지만 저런자가 후보라는데 민주당이 왜나오냐. 쌍팔년도에도 친구들한테 자리 하나씩 주는건 안했을듯.
군백기,첸 터지고 군백기되면서 자연스레 덕질도 멈췄는데.. 얘는 지가 깨버린 믿음을 몇배로 주려고 노력을 몇년동안 해왔던 앤데.. 괜히 인기멤이 아니야
그뭔씹,그뭔씹
기름지지,어릴땐 설화수 50 60라인이라 생각했는데30대인데 써보니까 개조음오히려 아이오페 이런게 기름지지 윤조라인은 깔끔함로제거 광고해서 쓰는건 아니지만할머니 브랜드라는 이미지는 많이 줄어든듯
끼린,자기 가족들이랑 여행 잘 안다녔나봐?ㅎㅎ 어머니가 계속 여행 타령 하시네에~ 자기가 모시고 한번 다녀와~ 난 그동안 좀 쉬든가 나도 울엄마아빠 모시고 다녀올겡 ^^ 이럼 끝.왜 남의 부모 뒤치닥거리까지 고민해야함. 이러니까 결혼을 안하려하지.평소에 지들끼린 여행 한번 안다니다가 며느리 들어오면 남들하는거 우리도 해보자고 용을 쓰드라.... 지겨와 K-시가
나사빠진사람,여자진짜..나도 여자지만 답답하고 모지리같더라 나사빠진사람이랑 왜살아….남자가 뭐라하니까 여자울때ㅋㅋㅋㅋㅋㅋㅋ지가 왜울어 남자가울어야지
남인생, 하하하 21살쳐먹고 인생타령하고 자빠졌네 인생은 그 누구도 모른다 부모도 모르는게 자식인생이다. 술집알바하다가 임신했던 친구가 애기 얼집보낼때쯤 본인이 술집차려서 대박날수도 있는게 인생이고 명문대다니던 친구가 졸업후 공시도전했다가 3-4년 날려먹고 볼품없는곳에 취직할수도 있는게 인생이야.니좁은 시야로 남인생 끝났다는둥 어설픈 훈수두지말고 니 할일이나 잘해
남인생,하하하 21살쳐먹고 인생타령하고 자빠졌네 인생은 그 누구도 모른다 부모도 모르는게 자식인생이다. 술집알바하다가 임신했던 친구가 애기 얼집보낼때쯤 본인이 술집차려서 대박날수도 있는게 인생이고 명문대다니던 친구가 졸업후 공시도전했다가 3-4년 날려먹고 볼품없는곳에 취직할수도 있는게 인생이야.니좁은 시야로 남인생 끝났다는둥 어설픈 훈수두지말고 니 할일이나 잘해
남자버전, __ 판녀들 채령은 몇년동안 조카 괴롭히더니 남자버전 채령은 착즙하네 채령한테 사과해라
내돌,이런글 안쓰면안돼? 내돌까지 어그로끌리는거 진짜 너무 싫어ㅠㅠ
내타입,넌 너무 내타입이야나한테 관심없는 사람 이렇게 좋아할수가 있나속상하다 
노성의,"저요저요. 제가 그거 아직도 당하고 살고 있어요. 그놈의 제사,가문 타령하면서 들들 볶아 결국에 우울증으로 처방받아약도 먹었구요. 아직도 손자있는 집만 차별하며 예뻐합니다. 남편이 한때 가스라이팅 당해 우리 셋째 가질까? 했는데 이건 아들을 생기면 남은 우리 딸들이 더 큰 고통이겠구나 눈에 뻔히 보이는 그림이더라구요. 왜 자기 손자가 있는데 우리한테 저럴까 했는데 그 손자가 만약 잘못되면 대가 끊어지니 우리에게서 여분으로 하나 더 만들고 싶은거였구요. 지금 제가나이가 많아지니 더이상 얘기는 안하는데, 아직도 눈에 보이는 차별과 비교와 무시를 시시때때하고 있어요. 남편이 아무리 쉴드쳐도 어차피 말도 안통하고, 대들면 ㅈㄹ을 해서 내가더 피곤하여, 술먹고 싫은 소리 하면 정말 얼굴에 완전 싫은 티를 내고 뭐라 하면 듣고 싶어하는 대답만 단답형으로 헤어질때까지 하며 버텨요. (시모가 제 눈치를 보게요) 저의 (정신)승리 방법은.. 나중에 제사에 참여/관여를 안하는거네요. 남편한테도 얘기하고 합의 봤어요. 그리고 시댁일에는 노성의, 노신경으로 대응하고 있습니다."
뉴세라핌,뉴세라핌
뉴진스,굿즈 포카 여러종 끼워팔아서 그걸 음반판매량으로 둔갑시키거잖아 시디는 1종만 발매하게 해야되고 굿즈 포카판매량 따로 집계해서 음반판매량에 포함 시키지말고음반판매량 = 포카 굿즈판매량이잖아시디는 1종만 취급해야함 법으로 규정좀 했으면 좋겠다데뷔한 신인이 100만장팔고 멤버 많은 남돌들 수십종 포카판매를 음반판매라고 500만장 언플하는것도 웃김비정상적인 음반판매로 둔갑시키지말고 1종으로 빨리 규정좀 정하자제베원 라이즈 에이티즈 아이브 스테이씨 시은 스키즈 세븐틴 있지 더보이즈 에스파 아이들 미연  비비지  블랙핑크 제니 로제 트레저 소미 뉴진스 르세라핌 카즈하 사쿠라 투바투 방탄 정국 뷔 진 지민  엔하이픈 권은비 최예나 이채연  
뉴진스,방탄 블핑 뉴진스 드디어 한자리에 모였다
뉴진스,"오늘 저녁에 프리즈 서울 2023 파라다이스 아트 페스타했는데 한테이블에 같이 앉음방탄은 뷔 블핑은 지수뉴진스는 민지,하니 참석했고 같은테이블에 이수혁하고 정호연도 같이 앉음ㅅㅊㅇ 방탄소년단 뷔 블랙핑크 지수 뉴진스 민지 하니"
뉴진스, 소위 월클들만 모이는데 뉴진스가 벌써 있다는게 신기하네 막내동생느낌으로 있는거같고 귀엽ㅋㅋㅋ
뉴진스,뉴진스는 진짜 소속사 잘 만나서 부럽다
뉴진스,하이브 많이 컷네 뉴진스는 뷔입김으로 초대받은거 같은데 파라다이스랑 친하기도 하고
뉴진스,같은 테이블인진 모르겠지만 저기 씨엘 지디 대성도 있었음 ㅋㅋㅋㅋ 빅뱅 투애니원 방탄 블핑 뉴진스
뉴진스,뉴진스랑 지수랑 대화 했으려나ㅋㅋㅋㅋ무슨 말 했을지 궁금하다ㅋㅋ나도 껴줘ㅠㅠㅠㅠ
뉴진스,태연 윤아 수지 아이유 등 a급 연옌들이 매번 하나같이 거르는 이유.. yg╋뷔 허세들의 모임 ㅋㅋㅋ 뉴진스는 걍 끼워넣기고 ㅋㅋㅋ
뉴진스," NCT 127, NCT DREAM, 스트레이키즈, 투바투, 엔하이픈, 에이티즈 뉴진스 ,엔믹스, 아이브, 르세라핌, ITZY, 에스파, (여자)아이들작년 모든 연말 라인업에 들어간 1군 13팀올해 연말 라인업도 저 13팀만 다 나올 듯 ㄹㅇ  성지글 "
뉴진스, 바이럴 작작좀 저기서 1군은 뉴진스 아이브 르세라핌 에스파로 끝임
뉴진스,와..그 음들 이제는 뉴진스 르세라핌에. 이어서 아일릿까지 까겠네베플 좋아요보면 댓글쓴다음 계정여러개로 누른거임릇 까는 거 좋아요 수 보면 음들 계정 200개있는것같던데
뉴진스,뉴진스는 초고속 뒷방 늙은이신세 ㅋㅋㅋㄱ
늦둥,"추가 조금 할게요회사 집만 왔다갔다 하던 사람이고 취미로 하는 운동도 첫째 둘째 데리고 다녔었어요 홀시어머니 계시는데 지금 상황들 의심되는 정황들 말씀드렸더니 니가 직접본게 뭐가 있는데 사람잡냐고 화내고 전화끊어버리네요애들 시댁에 데려다놓으면 다시 집앞에다 두고 갈 사람이고,그렇게 까지 하지 못하는 제일 큰 이유는 아이들에게 여기서 더 큰 상처주고싶지않아요.. 첫째둘째 초딩고학년이고 막내 늦둥이본거라 큰 아이들은 대충 무슨상황인지 눈치껏 알고 있어요통장내역은.. 공인인증서도 없고 그저 은행고객센터로 입출금기록만 확인하는거에요... 남편한테 생활비 받아 생활했고 그사람은 월급통장하나 공과금통장하나 달장 두개로 현금이나 체크카드만 사용했어요 제 앞에서는요...내일 변호사 만나러 갑니다.. 아 그리고 사람아닌 개같은 인간은 셋째 낳고 수술했어요 아쉽게도 사생아로 빌빌기는 모습은 당장 볼일없겠어요아이들만 보고 버텨보겠습니다. 조언감사합니다....안녕하세요 아들만 셋 키우는 주부입니다...지금 제가 할 수 있는게 뭔지 어떻게 행동해야하는지 조언받고싶어서요..남편이 하루아침에 사라졌어요 전날까지 아무렇지도 않게 대화하고 사이좋았는데 연락도 없이 집에 안들어왔어요회사에 연락해보니 이미 퇴직금 월급 정산받아서 퇴사했다고 몰랐냐고 하더라구요 바로 가출신고부터 했는데 이 사람이 누구랑 연락하고 지내는지 누굴 만나고 다니는지 아는게 아무것도 없어서  통장입출금 내역부터 조회하니 여기저기 모르는 이름으로 백단위로 주고받고 현금이 생기면 다 뽑아가네요그러던 중 회사 사람한테 연락이 왔어요 퇴사 이틀전에 집에 일이 생겼다며 급하게 백만원을 빌려갔대요 언제 줄수있냐는데그때 핸드폰이 두개인걸 알았어요 퇴근하고 집에 오면 핸드폰 쳐다도 안보고 손도 안댓었는데 세컨폰이 있었네요애들 다 데려가라 이혼하자 하니 아무 연락없다가그냥 내가 다 데려가겠다 하니까 바로 연락왔어요언제 몇시에 법원에서 볼꺼냐고.. 애들문제고 집문제고 상의를 해야하니 집으로 오라고 했더니 서류야 법원에서 쓰면되고 상의할게 뭐가 있냐 집에 오라는게 이상하답니다 그 말에 뭔가 쎄해서 통장내역 다시 보니 돈이 20,30씩 들어와요 그와중에  어제 강남가서 일본식 파스타 먹었네요 ㅋ 여자 옷가게에서 옷도 사고..  그동안 도박만 의심중이였는데 외도까지 하는 모양이에요변호사상담신청은 해뒀는데 도박이던 외도던심증만 있고 물증이 없는상태라 소송해봐야 이혼소송일테고협의이혼을 하자니 쓰레기에게 날개를 달아주는 꼴이라 싫고지금 판단이 안서는 상황이에요 폰도 남의 명의 차도 없어 집도 전세 재산나눌것도 당연없고그저 양육비랑 집 문제로 얘기하려는건데 뭐가 이상한걸까요이혼하게 되면 친정부모님께 도움받을수있는 여건이라 부모님은 돈 걱정 집 걱정은 하지 말라시는데 지금 행동이 괘씸해서라도 뜻대로 해주지말아라 애들 데리고 이혼해준다하니 마음 급한거다 하시네요벌써 집나간지 2주째고 막내가 겨우 6개월인데 그동안 나한테 애들한테 뻔뻔하게 행동하던 모습들이 생각나서 화가 치밀었다가 그 감정마저도 아까워 차분해졌다가 왔다갔다합니다  제가 지금 당장 뭘 해야할까요"
니부모,ㅋㅋㅋ 압구정대치목동잠실 복도식 아파트 빼고는 걍 못사는 거지동네 맞아;; 그리고 니네부모님이 가정교육을 그렇게 잘시키셨으면 고기 집에서 구워먹지 말고 나가서 사먹으라하지 니 식사시간의 고기구움은 되는거고 남의 식사시간 고기구움은 안되냐? 니논리대로면 니부모도 가정교육 똥망으로 시켰는데?? 돈도없는게 어디 복도식 아파트 사서 으스대고 있어ㅋㅋㅋㅋ
님친, 살다살다 님친도 아니고 남편의 잠수 이별은 처음보네요. 진짜 뭐 저딴 쓰레기가 결혼을 한거지
다른걸,질문: 1종이든 여러종이든 어짜피 사재기 할 사람은 사재기 하지않아?? 그리고 포카... 앨점사니까 딸려 나와서 가지고 있긴한데 난 이름검색하면 나오는 사진들이랑 다른걸 모르겠다...포카 왜 좋은거야??
댓보,"여기 베댓보면 간헐적단식 이야기가 많이 나오는데, 살을 덜찌게 할 수는 있어도 살을 빼는건 어려움. 그리고 사바사인데 간헐적단식 자주하거나, 공복시간이 긴 생활패턴이면 나처럼 담낭결석 걸릴 수도 있음. 나도 알고싶지 않았음… 무작정 굶는다고 살안빠짐;; 잘 찾아보고 알아본 후에 자신의 체질에 맞는 다이어트 했으면 좋겠다 모두"
댓보,지나가다 쓰니 답댓보고 내가 다 감동먹고 감.. 말하는거 짱예뿜 ♥️♥️ 항상 행복한일만 가득해
덕몰,윤상 아들 ㄹㅇ 덕몰이상이노
덕몰,케이팝계에서 덕몰이상이 무슨 뜻인 줄 앎? 안잘생겼는데 팬들이 콩깍지 씌어서 토끼상이니 햄스터니 빨아줄때 쓰는 말임 덕몰이 인터넷에 쳐보고 쭉 보면 차은우나 로운처럼 객관적 존잘은 없고 팬들만 염불외듯 외치는 덕몰이.. 좋은 말 아니니까 엔간하면 걍 안쓰는 게 낫다
덕몰,라이즈 둘이나 터지고 앤톤 영업에 사활을 건 느낌인데 문제는 글에서 올려치는 정도로 전혀 덕몰이 상이나 존잘로 보이지 않음 앤톤 글 거의 스팸처럼 올리던데 인위적이라고 느껴서 거부감 들어
도망챠, 그런 애들은 나중에 뭔일 생기고 앞으로 그러지말라거나 왜그랬냐 물어보면 왜 피해잔 난데 내 탓 하냐고 화냄.. 아니 지도 어느정도 그럴 상황의 여지를 안만드는 노력을 해야하는거 아님? 피해자라고 무조건 면죄부가 생기는 것도 아니고 진짜 개답답햐 외국 나가서 폰도 지갑도 그냥 두고 다니다가 뺏기면 지 잘못인거랑 똑같은데 진짜... 나도 그런 친구 있었는데 결국 내가 속터져서 손절쳤어 너도 도망챠..
도재정, 토즈 이탈리아 브랜드라 김정우 밀라노 패션 위크 갈 거 생각하면 개같이 설렌다....도재정 밀라노 전원 참석이라니 생각만 해도 뽕참
뒷광고,정국 악개들은 왜 주제파악 못하고 여기서 지민이 욕 하고있음? 역겨운 입건망구들아 고의로 사람치고 지형이랑 뒷광고한 느그새끼나 욕해 아무리 생각해도 일은 정국이가 더 크게 저질러놓고 지민이한테 이미지 떠넘기고 있어 훈장회수 청원까지 당하는 찐 범죄자 주제에 ㅋㅋㅋㅋ
뒷광고,전정국악개줌냐 뷔까는척 지민이랑 개정국 쳐엮는거봐ㅋㅋㅋㅋㅋㅋㅋ커플문신-입건송치-뒷광고-클럽충 개입건 개같이 패줄게
러셔,ㅋㅋㅋ 그냥 듣고 흘리시고 담부터 더 안 들려 주시면 되요..전 신혼때 시아버지께 2준가 3주만에 전화드렸더니.. 아니 이게 누구우시인가아~??? 이러셔서 너무너무 놀라 그 뒤로 아예 안 하고 있습니다. ^^
러셔,뭔가 쿨한 성격일줄 알았는데 부리더 계급 안무 뽑고 러셔? 가 죄송해요ㅠㅠ 하면서 울때 안아주는거 진심 반했음
러셔,나 아침에 피부 쉐딩 블러셔 섀도우두개 아이라인만 하는데 30분 걸림 하 시간 못 줄이나
러셔,썬크림 컨실러 쿠션 파우더 눈화장 쉐딩 블러셔까지 해서 20분 걸림
러셔,썬크림 톤업크림 블러셔 입술 15분
러셔,눈에 한 10분 정도 나머지 피부랑 블러셔 입술은 그냥 5분컷 다해서 15분 쯤 걸리는 듯
럽식콘,지금은 팬아니긴한데 작년 럽식콘 간이후로 다른 콘서트 두번 갔었는데 만족이 안됨.. 투바투 노래도 다 좋고 벅차오르는 노래가 많아서 더그런듯 너무 재밌었어 두밧두 와리와리할때 ㄹㅇ 울뻔함 
룰라팔루자,조나스 브라더스랑 디싱내고 룰라팔루자에선 코이르레이랑 무대하고 이번엔 아니타임 써놓고보니까 다 올해임ㅋㅋㅋㅋ대단
르세라핌,굿즈 포카 여러종 끼워팔아서 그걸 음반판매량으로 둔갑시키거잖아 시디는 1종만 발매하게 해야되고 굿즈 포카판매량 따로 집계해서 음반판매량에 포함 시키지말고음반판매량 = 포카 굿즈판매량이잖아시디는 1종만 취급해야함 법으로 규정좀 했으면 좋겠다데뷔한 신인이 100만장팔고 멤버 많은 남돌들 수십종 포카판매를 음반판매라고 500만장 언플하는것도 웃김비정상적인 음반판매로 둔갑시키지말고 1종으로 빨리 규정좀 정하자제베원 라이즈 에이티즈 아이브 스테이씨 시은 스키즈 세븐틴 있지 더보이즈 에스파 아이들 미연  비비지  블랙핑크 제니 로제 트레저 소미 뉴진스 르세라핌 카즈하 사쿠라 투바투 방탄 정국 뷔 진 지민  엔하이픈 권은비 최예나 이채연  
르세라핌, 르세라핌이야말로 홍은채가 언니들한테 나이 많다고 꼽주고 서로 사이 안좋아보이더라 ㅠㅠ 난 르세라핌 팬인데 좀 안타까워서? 댓글 써봐 ㅠㅠ
르세라핌," NCT 127, NCT DREAM, 스트레이키즈, 투바투, 엔하이픈, 에이티즈 뉴진스 ,엔믹스, 아이브, 르세라핌, ITZY, 에스파, (여자)아이들작년 모든 연말 라인업에 들어간 1군 13팀올해 연말 라인업도 저 13팀만 다 나올 듯 ㄹㅇ  성지글 "
르세라핌, 바이럴 작작좀 저기서 1군은 뉴진스 아이브 르세라핌 에스파로 끝임
르세라핌,와..그 음들 이제는 뉴진스 르세라핌에. 이어서 아일릿까지 까겠네베플 좋아요보면 댓글쓴다음 계정여러개로 누른거임릇 까는 거 좋아요 수 보면 음들 계정 200개있는것같던데
