단어,포함된 문장
본교재,"수학 만큼은 n수 하면서 안 풀어본 문제집 거의 없음지금 수학 과외 중임 본인 등급대나 궁금한 거 있으면 댓글 달아줘 본문에 수정해서 다 알려줌1. 6등급에서 4등급대 ( 5등급 이하, 노베는 이거랑 커리 똑같음 )일단 개념이 엄청 매우 부족한 상태임 4등급은 주요 4점 다 틀려도 안정 4는 나오기 때문에 메가나 대성 선생님 한 명 골라서 기초 개념 강의 하나 듣고 본교재+서브교재 베이스 두면서 최근 5년치 교육청+평가원 모고에서 ""2~3점""짜리 문제만 푸는 걸 최소 2~3주 안에 끝내 그리고 바로 쎈 B단계 싹 다 풀고 수능 때까지 네가 인강 들었던 선생님의 기출문제집 사서 풀고 ""강의까지"" 다 들으셈 정리: 1. 수능기초개념인강 + 워크북 기본 베이스2. 최근 5년치 2~3점 문제 풀기3. 쎈 B단계4. 인강 기출문제집 사서 해설강의까지 듣기5. 시간 남으면 5년치  모고 9번 10번 11번 찍먹(개념인강은 다 들어도 다 들은 후에 거기에 있는 문제 최소 10번 이상 풀기+ 기출 문제집은 틀린 문제만 2번 회독하기)2. 개념을 많이 돌렸는데도 성적이 안 오를 때문제점은 딱 2가지로 나뉨 정말 개념만 돌렸거나 개념을 제대로 돌린 게 아님첫 번째 문제는 개념만으로 풀리는 문제는 거의 없음 개념+문제를 풀어봐야 머리 속에 지식이 쌓이는 거고 문제 ""푸는 법""을 알 수가 있는 거임 그래서 내가 위에 1번 커리에서도 개념책이랑 워크북을 같이 풀라고 한 이유가 그거임 개념만 들으면 문제 적용이 어렵기 때문에 그날 배운 개념을 복습하고 문제 푸는 법을 배우기 위해 워크북을 푸는 거임두 번째 문제는 아마도 가장 큰 문제는 회독을 제대로 돌리지 않았거나 인강을 듣기만 한 문제임 우리 머리는 상위 1퍼센트의 머리가 아닌 이상 한 번 배우고 일주일 뒤면 다 까먹는 게 정상임 한 번으로 그칠 게 아니라 계속 된 반복을 통해서 공부해야 되는 거임 인강을 듣기만 한 케이스는 인강을 빨리 끝내야 된다는 생각 때문에 생각없이 인강을 듣는 거 일단 인강을 들으면서 강사가 하는 말 100퍼센트가 다 이해가 되어야 됨 왜 이런 식을 쓰고 이런 말을 하는지에 대해서 네가 생각해보고 깨닫는 시간이 있어야 네 머리 속으로 지식이 습득 되는 거3. 3점짜린 다 풀리는데 주요 4점 들어갈 때부터 막히는 케이스이런 케이스는 99.9% 문제를 많이 안 풀어본 친구들임 일단 4점 문제는 개념으로만 풀리는 문제가 절대로 아님 문제 속에 숨겨진 조건+개념을 통해서 풀이를 쓰는 과정이기 때문에 기출 문제를 굉장히 많이 풀어보면서 접근 방법을 아는 것이 좋음그 방법을 알려주자면 4점짜리 문제를 읽어보면서 이 문장은 어떠한 개념과 조건을 포함하는 걸까?? ex)이차함수 f(x)가 있다 |f(x)|가 f(1)=0이고 절댓값 |f(x)|가 실수 전체 집합에서 미분가능하다.문제 해석: 절댓값 함수에서 함숫값이 0이 될 때는 접할 때가 아니면 좌미분계수와 우미분계수가 다르기 때문에 (미분가능성의 정의) 미분가능하지가 않다 그렇다면 함숫값이 0일 때 x축에 접해야 좌미분계수와 우미분계수가 같기 때문에 f(x)는 x=1에서 중근을 가지겠구나라는 식으로 숨겨진 조건을 찾아내는 연습을 해야 됨 한마디로 공식적용만 하려고 하지말고 문제를 보고 내가 어떻게 접근을 해야 될까에 포커스를 맞추고 문제를 대해야 함4. 기출 해설 강의가 왜 중요한가?우리가 수능 공부를 할 때 가장 중요한 게 뭘까?바로 기출문제임 실제 평가원이 문제를 어떤 식으로 내는지 알 수가 있기 때문임근데 4등급 이하의 학생들한테 강의까지 들으라고 한 이유는 따로 있음일단 1~2등급 학생들은 이미 기출을 끝낸 것도 있지만 수학공부를 열심히 했다고 할 수 있기에 이미 머리 속에 알고리즘처럼 이러한 조건에서는 이런 풀이법을 쓴다는 메커니즘이 박혀있는 상태임 근데 그 이하로는 그게 전혀 없다고 보면 됨 그냥 공식적용... 이 문장이 뭘 뜻하는 거지...? 라는 생각만 한다는 거지 근데 해설지에서는 그런 말을 하나도 해주지 않음 그냥 풀이만 해주지 근데 강의는 일단 강사들이 강의에서는 이런 문제에서 해야 될 생각 적용되는 공식들을 설명해주고 따로 필기까지 해줌 또한 하나의 풀이방식이 아닌 여러가지 풀이방식을 알려주면서 네가 비슷한 문제를 만났을 때 풀 수 있는 방법을 여러가지로 알려준다는 거임 따라서 4등급 이하의 학생들은 시간이 걸려도 기출문제집을 풀면서 모든 문제를 모두 강의를 듣고 완벽하게 이해를 해내는 걸 수능 전까지의 목표로 잡으면 돼 "
비틱질,그럼 못생긴 여자로 살래? 비틱질 오지네 ㅋ
산독기독기,산독기독기야~
살식,살식적으로 본인이 올렸을리 있겠냐 설령 그랬더라도 댓글 반응 보고 겁먹고 내리지얘 엿맥일라고 글 올린 년은 인과응보 받아라..
삼천명,이걸 만 삼천명이 봤네
설정상,얘 만화 설정상 키가 계속 안자란다고 함ㅋㅋㅋㅋㅋㅋ
성격차,성격차이아님??외모 관계없이 관심받는거 싫어하는 성격이면 관심받을 때 스트레스 받아하고 아닌 사람들은 즐기고...근데 예쁜사람한테 좀 더 관심 집중되는건 사실이라서 내형적인 사람들은 스트레스 받을듯 나도 전직장 다녔을때 여자상사나 동료 한명이 나 혼자 사적인 얘기 안하는거 이상하게 생각함 밑에 현장언니들이 더 편해서 현장언니들이랑 더 많이 어울린건데 ㅋㅋ
성쇼,ㅠㅠ 단체콘 가기 전부터 갑자기 양양이 얼굴이 눈에 들어오더니 단체콘 다녀온 후로 짱 좋아짐 ㅠㅠ 콘서트에서 보여주려고 팬들이 좋아하는 핑크머리로 염색한 것도 기특하구 했는데 완전 따듯한 사람이었구나ㅠㅠㅠㅠ 양양이도 성쇼도 행복만 하렴 ㅠㅠㅠ
슈취타, 9/10 런닝맨 9/11 슈취타 9/14 엠카 9/18 CDTV 라이브라이브  모든 스케줄 많관부 
슈취타,뷔악개아줌마들 조카 웃기너ㅋㅋㅋㅋ슈취타는 다른멤때도 그렇고 다른 연예인 게스트들도 죄다 얼굴 안나오게 예고 내보내는데 ㅈ도 모르면서 예의따지고 공방 추첨도 그룹때나 개인때나 멤버쉽 똑같이 다 진행했는데 왜절해ㅋㅋㅋ 아줌마들이라 지 최애 유툽 컨텐츠 나오는것도 아이돌들 많이 출연하는 컨텐츠인것도 모르고 마플타더니 대박이네ㅋㅋ 
슈취타, 9/10 런닝맨 9/11 슈취타 9/14 엠카 9/18 CDTV 라이브라이브  모든 스케줄 많관부 
슈취타,지디컴백하면 슈취타 나올수 있겠다
스껄,스껄ㅋㅋㅋㅋㅋㅋㅋㅋㅋㅋㅋㅋㅋㅋㅋㅋㅋㅋㅋㅋㅋㅋㅋㅋㅋ
스껄,스껄이 ㅈㄴ 웃기네
스포티파,8월 30일인 지난주 수요일 올해 남돌 최초로 멜론 일간1위 찍고 오늘 드디어 남돌 최초로 멜론 주간 1위까지 함더 대단한건 스포티파이 차트는 어제부로 50일째 전세계 1위중남돌이 솔로로 이정도까지 국내외로 대중성 + 팬덤까지 다 잡은게 정말 대단하고 놀랍다 역시 방탄 메보는 메보구나 ㅊㅋㅊㅋ
스포티파,정국이 솔로 나오기 전 ㅡ> 정국 개인 실력은 없더라 다 그룹빨 운빨 ㅡ> 발매첫날 전세계 스포티파이 역사상 2번째로 최다 스트리밍된 가수됨 ㅡ> 방탄 원래 국내는 해외보다 인기없더만 솔로로 나와봐야 멜론에서 20위도 못들지 ㅡ> 발매 11시간만에 올해 남녀돌 전체 2번째로 빠르게 탑백 1위 찍음 ㅡ> 빌보드 1위 딴멤도 했는데 못하면 방탄 메보로서 개망신 아님? ㅡ> 룰바껴서 공홈 다운 막히고도 빌보드 핫백 핫샷 1위함 ㅡ> 2주차부터 최대 폭락 핫백 광탈할껄? 전부 사재기 페이올라 하이브 광푸쉬 프로모자나 ㅡ> 6주째 핫백 30위권내 유지중ㅡ> 요즘 젤 핫한 라또 피쳐링빨이네 ㅡ> 라또 8월 신곡 차트아웃함 ㅡ> 아직도 멜론 일간 2위야? 대중성도 없네 일간 1위나 하고 떠들어 ㅡ> 10년만에 남자 솔로 최초 데뷔곡으로 일간 1위함 ㅡ> 일간 1위 꼴랑 하루? 기껏 찍먹하고 나가떨어지겠지 ㅡ> 주간 1위함 ㅋㅋㅋㅋ 진짜 정국 까들이 꿈꾸고 정국이가 다 이룬다 ㅋㅋㅋㅋㅋㅋㅋㅋㅋㅋㅋㅋ
스포티파,탑백인줄알았네 ㅂ ㅅ 무슨 스포티파이 바이럴차트 이딴 개듣보차트 들고와서 자랑하는꼴이네
실감나,로제한테 해외팬들이 천사같다고하는말이 찐으로 실감나는사진이다 ㅋㅋㅋ 갠적으로 난 생로랑 스타일 기괴해서 별로고 설화수랑 티파니앤코 스타일링이 좋음 생로랑은 뭔가 이상함 그 브랜드 특징인건 알겠는데 너무 노출심한 AI 컨셉같아서 정이안감 로제좀 예쁘게 해줬음좋겠어 생로랑 스타일링좀 바꾸지
실전개념,실전개념 강의 들은거야? 그거 들었으면 차분하게 첨부터 끝까지 회독하고 기출에 그 실전개념들 녹여서 풀어봐 글고 마지막에 잘 풀었는지 강의 들으면서 쌤 풀이랑 비교하고 뭐가 부족한지 보완하는 식으로 공부해보는건 어때
쓰니님,예전에도 자상하고 친구같은 아버지들도 많았겠지만 육아는 엄마 몫으로 남겨뒀던 시대였잖아요. 쓰니님도 위에 적은것처럼 아버님은 돈버느라 바쁘셨고 그게 가족을 위한 길이라고 생각하셨을 거예요. 그렇게 교육받기도 하셨구요. 이미 지난간 일을 돌이켜봐야 아무런 해결책은 없어요. 그럴수밖에 없던걸 인정하시고 쓰니님 본인이 자상한 부모가 되도록하세요.
쓰니님,"쓰니님, 20대초반이고 아직 돈을 안번다면할아버지 유고시에 집을 유지는 어찌하나요?매년 재산세도 나오고, 관리비(전기,수도,가스...)도 발생하쟎아요?님 앞으로 받을려고 하는것만이 능사는 아닙니다.상속세,취득세도 대출받아야 하지 싶은데, 소득없으면 집담보로 대출 안됩니다.어영부영하다가 할부지 가시면, 현금이 없어서 경매처리될수도~"
안녕즈,아이브 안녕즈 별로 안친한것 같음..
안녕즈,아이브 안녕즈 별로 안친한 것 같음다이븐데 사람들이 하도 친하다 각별하다 그래서자컨 봤는데 오히려 레이랑 안유진이랑 친하고 원영이랑은 별로..오히려 둘이 프듀랑 아이즈원때 친했던 것 같음까는게 아니라 분명 아이브 초반까지만 해도 친한게 보였는데 요즘은 안보여서 팬으로써 조금 슬프기도 하고 좀 씁쓸..최근에는 안녕즈 꽃다발 만들기도 나왔는데 딱히 둘이 엄청 친해서 같이 하기보단 그냥 각자 꽃다발 만들기에만 집중하는 것 같았음 불량도 엄청 안나오고 긁을대로 긁어서 쓰셨던데 안녕즈 팬으로써 요즘 너무 슬픔 불화설 까진 아니지만 조금 서먹? 총정리 하자면 막 엄청 친한것도 아니고 안친한 것도 아닌 그런사이 같음님들생각은 어떰?+다들 하는 얘기 들어보니까 이제 알겠어내 자신을 팬이라 하기 부끄럽다..좀더 말을 조심했어야하는데 그냥 철없이 둘이 안친해서 아쉽다 이딴 글 쓰고있다니 이제 글 내릴게.!
안녕즈,안녕즈 사이 이간질 안통한다고 몇번을 말하니 하긴 학습능력이 없으니 정병짓이나 하는거겠지 ㅎ
안녕즈,안녕즈 이젠 언니동생 하는 멤버말고 가족처럼 보임 상 받은 후에 원영이 눈 마주치자마자 유진이 울상 짓는거 ㄹㅇㅜㅜ 
안녕즈,진심으로 아이브 최근 영상 몇개만 봐도 안녕즈 뿐만 아니라 어느 멤버랑도 불화설 절대 못터뜨리는데 ㅋㅋㅋㅋㅋㅋㅋ 그냥 죄다 지들 피셜로만 처 씨부리고 다니니..ㅋㅋㅋ
안녕즈,안녕즈가 자컨이나 뭐나 팀하면 밸런스가 안맞아서 무조건 떨어뜨려놓긴함ㅋㅋ큐ㅠ 이움짤나온 자컨도 안녕즈가 밸런스안맞게 이기긴해서.. 그래도 안친한건 아님 데뷔초부터 안좋은얘기 많아서 원영이는 좀 기를 쓰고 친목 절대 안하는타입같아 
알수도,대박 정상이 없넼ㅋㅋㅋㅋㅋㅋㅋㅋㅋ단독주택 가서 살라고? 좀 참신한거 없음? 맨날 똑같냐 어떻게단독주택을 권한다면 매일 매일 연기피우면서 시간 못가리고 고기 생선 구워먹는쪽이 단독주택 사는게 맞지 않음?요새 문해력 딸리는것들 많다더니 글은 제대로 읽었냐?요리할때만 냄새나는줄 아는 저능아들..할말하않문을 왜 여냐고? 내집에서 환기도 못시킴?ㅋㅋㅋㅋ빨래도 못널음?ㅋㅋㅋㅋㅋㅋ건조기 있으면 빨래 널일이 없는줄 아는거 어이없네살림을 해봤어야 알지.. 부모 집 얹혀살면서 살림 한번 해본적 없는 백수들은 그냥 입닫아....워시타워 있고 공청기 방마다 있으니까 걱정말고식사시간 피해서 환기를 시키라고?아침 점심 저녁으로 냄새 올라오고 심지어 자정에도 삼겹살을 구워먹는데 그럼 뭐 새벽 3-4시에 환기 시켜야 하나?꼭 당해봐야 아는 능지 낮은것들이 입만 살아서^^아니면 외식할돈 없어서 베란다에서 고기구워먹는 거지들인강ㅋㅋㅋㅋㅋ좀 사먹어...짠하다이래서 돈벌어야함ㅋㅋㅋㅋㅋㅋㅋㅋ하향평준화 쩐다 진짜니네가 그렇게 싫어하는 짱개스럽다 진짴ㅋㅋㅋㅋㅋ정말 요새 다들 여유가 없구나난 부모님과 함께 살때도 부모님께서 늦은밤엔 고기 못구워먹게 하셨어문닫고 구우면 가족한테 피해고문열면 다른집한테 피해준다고난 이게 기본이라고 생각하고 살아왔거든?뭐 이런 기본적인 가정교육 안받았으면 어쩔수 없긴한데내 집이니까 뭘 하던 내 자유! 이건 진짜 ㅎㅌㅊ 인생 아니냐부들부들대면서 냄새가 싫으면 단독주택가 빼액하면단독주택 가야하는구나 쭈글..하길 바랬나본데댓글중 본인힘으로 독립해서 경제활동하며 자가 사는 사람 몇이나 될까?내가 아랫집가서 살인을 한대? 불판을 부셔버린대?난 이런경우 처음이니까 겪은사람 있냐고 물은거잖아대체 여기서 건조기 공청기 얘기가 왜나오는거야..?그럼 건조기 공청기 없는 사람들은 담배냄새 올라와도 참아야겠네? 내 집에서 내가 담배피는건 내 자유잖아? 불법 아니잖아어떻게 이렇게까지 날이 설 수 있는거지....진짜 다 그지들인가보다 싶다난 이렇게 살아가지 말아야지이사한지 보름 됐습니다다른게 아니라 밑에 집에서정말 매일매일매일 아침 점심 저녁고기랑 생선을 구워먹어요복도식아파트라 현관문 베란다 창문 열어두면바람 슝슝 통하는 구조인데도 엄청 심하게 냄새가 올라와요베란다에 널어둔 빨래에도 냄새 다 배고어제 날이 선선해서 베란다 문열고 방창문 열고잤는데새벽 한시에 방안에서 삼겹살 냄새가 나더라구요오늘은 아침에 일어나서 환기시키려고 베란다문 열어뒀는데씻고 나오니 온집안에 생선냄새가 진동을해요밥해먹는거 자유이고 뭘먹던 자유인거 아는데30년 넘게 살며 이렇게 매일매일 아침저녁으로다른집 냄새가 심하게 나는건 처음이에요환기를 시킬수도 빨래를 널수도 문을 열고 잘수도 없어요여기가 통풍이 안되는 구조도 아니고바람이 정말 잘 통하거든요제생각에 냄새의 정도로 봤을때 아랫집이 부엌이 아니라 베란다에서 구워먹는것같아요정말 우리집에서 해먹는 냄새가 나요이번집 이사오기 바로전에도 복도식아파트였고음식냄새가 나긴했지만 창문을 못열거나빨래에 냄새가 밸정도는 아니었거든요근데 아랫집 어디에서 올라오는 냄새인지 정확히 알수도 없고안다고 해도 먹는걸로 뭐라하기도 뭐라하고와 진짜 이런걸로 스트레스를 받을수도 있네요저같은 경험 하신분 계실까요이거 어떡해야할까요층간악취때문에 미치겠습니다ㅠㅠ 
알유넥스트,"하이브 연생 대상 서바이벌 <알유넥스트>최종투표 1~2위는 자동 데뷔, 추가 4명은 소속사가 선발하이브 레이블 빌리프랩 소속으로 내년 초 정식 데뷔막방으로 확정된 데뷔 멤버 6인   원희 07.06.26최종투표 1위 영서 05.11.13최종투표 2위 민주 04.05.11최종투표 3위, 소속사 선택 이로하 08.02.04최종투표 5위, 소속사 선택 모카 04.10.08최종투표 8위, 소속사 선택 윤아 04.01.15최종투표 7위, 소속사 선택  얼굴 합은 잘 맞는 것 같아 데뷔하게 된 거 ㅊㅋㅊㅋ  "
애보라,쓴이 10대임?? 제이쓴이 엄마고 홍현희가 아빠라고 보면 이해감?? 모든 아빠들도 일 하지 말라하고 애보라고 하면 잘봐. 특히 90년대생들은.
앤톤,원빈 앤톤이라고 이 둘은 절대 안 바뀜 2군 싸움이 치열할 뿐이지 반박시  
앤톤,앤톤은 얼굴보다 피지컬이 다 한듯
앤톤,라이즈 첨 떴을때 원빈 앤톤 저 둘만 눈에 들어옴 판에서 거의 매일 톡선에 가는 것도 쟤 둘말고 더 있냐 ㅋㅋㅋㅋ
앤톤,앤톤 나만 개호감임???
앤톤,"라이즈 틱톡계정 챙겨보는데 최애될거같음 진심앤톤이가 브이로그?라고 영상찍고 후시녹음하고 편집해서 올려준 영상 있는데 진짜 개귀여움...영어로 뭐라뭐라 설명하는데 목소리 진짜 ㅅ ㅂ 졸귀이런거 자진해서 찍어주는돌 첨봄ㄹㅇ그리고 먼 어릴때 찍은 인터뷰?그거보면지금이랑 달라진게 하나도 없던데 애교도 원래 많았던거같음 비게퍼가 아니라,,걍 진짜 무해한인간같음 귀여운 쿼카ㅜㅜㅜㅜ "
앤톤,앤톤 자꾸 눈이감..
앤톤,앤톤 이미 인기 엄청남….ㄱㅇㅇ
앤톤,라이즈 둘이나 터지고 앤톤 영업에 사활을 건 느낌인데 문제는 글에서 올려치는 정도로 전혀 덕몰이 상이나 존잘로 보이지 않음 앤톤 글 거의 스팸처럼 올리던데 인위적이라고 느껴서 거부감 들어
여섯명,첫무대 한거보고 바로 딱 민주 영서 지민 윤아 정은 혜원 여섯명 픽 했었음 막방에 그중 다섯명 올라갔는데 3명밖에 데뷔 못한거 넘 아쉽ㅠㅠ
영원럽, 나 영원럽 개좋아하는데 공동1위라니 들어볼게
영원럽,오해가 있는 것 같아서 설명하자면 영원럽이 워낙 명곡이라 애들도 다 좋아했어서 영원럽만큼 좋다 이 표현이지 영원럽이랑 비슷한 느낌의 곡은 아님! 
영원럽,영원럽같은 곡이면 울거임ㆍㆍ
올드머니룩, 토즈 너무 좋음... 요즘 올드머니룩 유행인데 토즈는 옛날부터 뚝심있게 올드머니╋로고리스 추구해왔던 것도 그렇고 찾아보니까 앰버서더 엄청 신경쓰고 아껴주는 것 같음. 조이보면 컴백이나 생일이나 이벤트 있는 날이면 케이크에 편지에 디렉터가 자체제작 이름 박힌 백 선물해주고 한국 담당자랑 사적으로도 친해서 같이 놀러다니는 것 같던데 토수종의 기운이...느껴짐.. 정우도 앰버서더 됐다는 게시물에 팬들이 축하댓글 다니까 토즈 공계가 하나씩 좋아요 눌러주고 있던데 토즈패밀리 진심 호감됨ㅋㅋㅋㅋ 앞으로 정우랑 뭐할지 엄청 기대된다 
올리지, 누나랑 거의 연 끊었다는 부분에서 걸러야 됩니다. 정신 못 차리고 결혼해서 나중에 후회된다는 글 올리지나 마세요.
올챙,이게 왜 주작이야 충분히 가능성있어. 시부모 집에서 밥먹었는데 장염이 5개월감. 반찬 싸줄떄 보니까 지들이 처먹던거 젓가락 다 닿은거 나한테 주는거였어. 그리고 나머지 침이 뒤섞인 반찬은 그대로 냉장고에 넣더라. 남편배가 올챙이 배처럼 볼록하거든? 내생각엔 헬리코박터균이 가득할거같더라. 그때이후로 남편이랑 키스도 안함 ^^
윈터버블,윈터버블영업 ㄹㅇ사기수준임
윈터버블,윈터 아까부터 버블 수십개 보내고 있는데?ㅋㅋ 사진도 많이 보내주고 윈터버블 안하는년이 까려고 애쓰네 버블 영업한거 본적도 없는데
윤정부,윤정부 라인중에 제대로 된 놈 봤냐?
인따,나는 저런 연예인 실물짤들에서 공통으로 느껴지는얼굴이 작으면서 얼굴라인이 샥 가늘어 그 샥 가늘어지는 브이라인따라 스르륵 드러나는 목라인이 딱 전체적으로 얼굴이 ㅈㄴ 짝은게 강조되고 실물이 대박이다.. 느껴지는 그게 있는 거 같음 웬만한 요즘 예쁘다하는 젊은 연예인들의 모든 실물 샷을 보면서 느끼는 공통점임...관리되서얼굴이 샥 들어가면서 개짝고 그게 고운 목라인으로까지 이어진 그 느낌이일반인에서는 잘 없는 아우라를 만드는 거같음
인스스,나 화장시키고 싶다고 해서 놔뒀더니 이꼬라지로 한거봐ㅋㅋㅋ 진심 핰ㅋㅋㅋㅋ 이와중에 친구가 지는 맘에든대 요즘 인스스 하기 빡세다 
인스스,대가리가 있는년이면 음침하게 지친구 인스스 캡쳐해서 판에 올리진 않았겠지 본인사진이라고 예상하는댓글 있어서 하는말인데 본인도 아닐 확률도 높고 어디 팔로우 1~2만쯤되는 인스타녀 캡쳐해서 올렸을 확률 농후함
인스스,인스스=인터넷 스터디 스타?
자컨,아이브 안녕즈 별로 안친한 것 같음다이븐데 사람들이 하도 친하다 각별하다 그래서자컨 봤는데 오히려 레이랑 안유진이랑 친하고 원영이랑은 별로..오히려 둘이 프듀랑 아이즈원때 친했던 것 같음까는게 아니라 분명 아이브 초반까지만 해도 친한게 보였는데 요즘은 안보여서 팬으로써 조금 슬프기도 하고 좀 씁쓸..최근에는 안녕즈 꽃다발 만들기도 나왔는데 딱히 둘이 엄청 친해서 같이 하기보단 그냥 각자 꽃다발 만들기에만 집중하는 것 같았음 불량도 엄청 안나오고 긁을대로 긁어서 쓰셨던데 안녕즈 팬으로써 요즘 너무 슬픔 불화설 까진 아니지만 조금 서먹? 총정리 하자면 막 엄청 친한것도 아니고 안친한 것도 아닌 그런사이 같음님들생각은 어떰?+다들 하는 얘기 들어보니까 이제 알겠어내 자신을 팬이라 하기 부끄럽다..좀더 말을 조심했어야하는데 그냥 철없이 둘이 안친해서 아쉽다 이딴 글 쓰고있다니 이제 글 내릴게.!
자컨," 그냥 이제 가족같은거지. 믿는구석, 든든한 동료. 둘이 친한모습 보이거나 둘만 놀면 다른멤버들 따시킨다고 악플올라올거 아니까, 자컨보면 둘이 든든하게 끌고가고 되도록 다른편하면서 다른멤버들 분량 만들어주는거 보기좋음."
자컨,안녕즈가 자컨이나 뭐나 팀하면 밸런스가 안맞아서 무조건 떨어뜨려놓긴함ㅋㅋ큐ㅠ 이움짤나온 자컨도 안녕즈가 밸런스안맞게 이기긴해서.. 그래도 안친한건 아님 데뷔초부터 안좋은얘기 많아서 원영이는 좀 기를 쓰고 친목 절대 안하는타입같아 
자컨,"근데 얘 성격이 진짜 말랑하고 좋음.. 자컨 몇개 봤는데 맏형이라 멤버들 잘 챙기고 장난 잘 받아주고 우쭈쭈 해주는데 멘탈 쎄고 감정기복 없음,, 공감 잘하는 t의 정석임"
잼리퍼블릭,"리더 계급 마지막으로 커스틴이랑 춤 추고나서 평가할 떄 멀리서 둘이 따봉 날리고 격려하고 있던데 걍 그런 인성이 마음에 듦. 갠적으로 베베, 잼리퍼블릭, 울프 멤버들이 맘에 듦. 울프는 첨엔 기빨리는 이미지라 별로였는데 생각보다 웃긴 캐릭터들이고 베이비슬릭 춤추는거 멋있고, 리더 멋진 춤 추고싶다 소신발언 한것도 멋있었음. 커스틴은 뭐 1화부터 상대방 존중하는 모습 존멋이었고, 바다도 실력 좋고, 착함."
저연차,고인물 많고 저연차 없는 회사
