단어,포함된 문장
츠바킬,진짜 말도 안 돼.....누가봐도 떨어질 실력이 아님 케이팝 미션 베베랑 붙고 방송 전에 유튜브로 평가해서 그렇지 츠바킬 케이팝 미션도 개잘했고 배틀도 잘했는데 하필 배틀 상대가 울플러.... 방송하고 공개되기만 했어도 츠바킬 탈락배틀은 안 갔음 걍 세상이 츠바킬을 억까함 난 츠바킬을 더 보고싶은데ㅜ 솔직히 모두가 생각하는 그 팀이 떨어지는 게 맞다고 생각함
츠바킬, 아니 애초에 츠바킬이 케팝 대결에서도 7등한 게 노어이임ㅜ 반응도 좋았고 솔직히 모두거 잘햤다고 생각햇는데ㅜ
츠바킬,케이팝 미션 너무 별로여서 오히려 츠바킬쪽이 결과 납득 못 하는 게 너무 의외였는데?!
츠바킬,솔직히 케이팝 미션 별로던데.. 방출 팀 결정할 때랑 안무 구간 짤 때는 츠바킬이 더 잘했는데 완성된 풀영상 보면 생각보다 별로였음
츠바킬,"츠바킬 잘했지만 순위나 점수로 봤을 때 바로 납득되던데..? 계급 미션에서도 레나 빼면 각 멤버들 눈에 띄게 잘하는 멤버 아무도 없었고, 케이팝 미션 때도 와 진기명기다.. 춤이 졸라 쎄다.. 하는 느낌 빼곤 뭐 없었음 당연히 잘하지만 케이팝 미션에는 좀 안 어울리는 느낌? 하필 또 베베랑 붙어서 그게 더 부각되기도 했고,, 앞선 미션까지만 보면 울플러가 떨어지는 게 맞을 수도 있겠는데 탈락을 배틀로 정하는 게 룰이니 배틀에 특화된 울플러가 남을 수밖에 ㅠ"
츠바킬,아니 애초에 츠바킬이 케팝 대결에서도 7등한 게 노어이임ㅜ 반응도 좋았고 솔직히 모두거 잘햤다고 생각햇는데ㅜ
츠바킬, 울플러는 저렇게 보여줄거면 왜 붙였는지 의문.. 츠바킬이였다면 어땠을까 하는 아쉬움이 큼. 울플러한테서 더이상 기대가 하나도 안 됨 이번 탈락배틀때도 별로.. 모니카 반응 보고 전혀 공감이 안 되더라
츠바킬,울플러는 저렇게 보여줄거면 왜 붙였는지 의문.. 츠바킬이였다면 어땠을까 하는 아쉬움이 큼. 울플러한테서 더이상 기대가 하나도 안 됨 이번 탈락배틀때도 별로.. 모니카 반응 보고 전혀 공감이 안 되더라
츠바킬,갑자기 바다 악플 늘어난 이유:바다가 키가 커서 키작남들의 열등감 건드림╋스우파2에 일뽕 많은데 츠바킬이 베베한테 져서 떨어지니까 억지부리는 거
탈락배틀,"난 오히려 울플러가 탈락배틀 간 게 더 말 안 된다고 생각함 울플러 vs 원밀리언 보면 취향 차이지 둘 다 잘 했음 솔직히 츠바킬vs 베베는 누가봐도 베베가 훨씬 잘 했는데, 논란 생긴 게 더 의아함 프로그램 반영 후에 투표했어도 베베가 이길거라고 생각함"
탈락배틀,진짜 말도 안 돼.....누가봐도 떨어질 실력이 아님 케이팝 미션 베베랑 붙고 방송 전에 유튜브로 평가해서 그렇지 츠바킬 케이팝 미션도 개잘했고 배틀도 잘했는데 하필 배틀 상대가 울플러.... 방송하고 공개되기만 했어도 츠바킬 탈락배틀은 안 갔음 걍 세상이 츠바킬을 억까함 난 츠바킬을 더 보고싶은데ㅜ 솔직히 모두가 생각하는 그 팀이 떨어지는 게 맞다고 생각함
탈락배틀, 울플러는 저렇게 보여줄거면 왜 붙였는지 의문.. 츠바킬이였다면 어땠을까 하는 아쉬움이 큼. 울플러한테서 더이상 기대가 하나도 안 됨 이번 탈락배틀때도 별로.. 모니카 반응 보고 전혀 공감이 안 되더라
탈락배틀,울플러는 저렇게 보여줄거면 왜 붙였는지 의문.. 츠바킬이였다면 어땠을까 하는 아쉬움이 큼. 울플러한테서 더이상 기대가 하나도 안 됨 이번 탈락배틀때도 별로.. 모니카 반응 보고 전혀 공감이 안 되더라
터사,기각됐으니 망정이지 법적 공방까지 갔으면 다른 엔터사들에서도 가만히 안있었을거임. 핍티가 이겼으면 한국 연예계 초토화 되는 게 기정 사실이라...
통수돌, 통수돌은 죽을때까지 위약금이나 갚길
통수돌, 댓글 한사람이 썼냐? 통수돌 쉴드 쩌네용
투바투,  드디어 새걸그룹으로 다시 하시는듯피프티것들은 이젠 끝났고 착한애들로 잘 뽑으시길제베원 라이즈 에이티즈 아이브 스테이씨 시은 스키즈 세븐틴 있지 더보이즈 에스파 아이들 미연  비비지  블랙핑크 제니 로제 트레저 소미 뉴진스 르세라핌 카즈하 사쿠라 투바투 방탄 정국 뷔 진 지민  엔하이픈 권은비 최예나 이채연 
투바투,투바투 스키즈 VMA
투바투,투바투랑 스키즈 둘다 상받은거 축하해  
투바투, 나 스테인데 스키즈 상 받을때 투바투 벌떡 일어나서 축하해주더라 괜히 내가 다 고맙고 서로 많이 의지도 되었을거같아 보기좋더라!! 둘다 흥하자
투바투, 투바투 스키즈 둘다 상받음 대박~~
투바투,투바투 코디 미국에선 저런게 먹히나
투바투,호랑이(방탄) 없는 곳에서 여우(스키즈&투바투)가 왕노릇 하는구나
투바투,팬도아닌것들이 유독 투바투스키즈 갈라치기 오짐얘넨 서로 리스펙하고 친하기까지한데 둘다 다른분위기로 매력이 다르고 무대볼맛남
투바투,투바투는 진짜 코디 갈아야겠다 얼굴이 다 함
투바투,목소리도 걸걸하고 그냥 음치야 팬덤이 약해서 차트아웃 직전이던데 겨우 올라가고있는중블랙핑크 트와이스 레드벨벳 에스파 스테이씨 뉴진스 전소미 아이유 아이브 르세라핌 방탄소년단 엑소 엔시티 샤이니 세븐틴 투바투 제베원 라이즈 스키즈 더보이즈
틀퀴,개못생긴 나봉퀴랑 지수를 엮네 틀퀴새기
티곡,배기진스 듣고 완전 이수만이 픽했을 엔시티곡 같다고 생각했는ㄷ데
파혼선언,나 결혼할때 생각남. 남편이름으로 자가있었고 빚없댔음. 그리고 이름있는 회사다니고 빚없이 자차 있댔음. 대신 홀시아버님 모시고 살아야한댔음. 노총각 아들 결혼 못보내서 걱정많은 아버님이었음. 남편보다 두살 연상분이 남편 보고 깐적있음...엄마가 주선자라 내가 내막을 살짝 알고있음.. 있을거 다 있으니까 빈손으로 와도 된댔음. 본인 9-6시까지 노인정에 있을거고 점심도 거기서 먹을거니까 신경쓸거 많이 없을거라했음. 전업해도 괜찮다고 했음. 그때 내가 일년 이상 놀고 있었음. 벌어논 돈도있었고 솔직히 외모가 좀 괜찮은 편이기도 했었음.  나는 성격도 좋아서 어르신 잘 모실수도 있다 생각했음. 선한번 봐볼까 해서 봤는데 외모는 진짜 내취향이 아니었지만 뭔가 성격이 잘맞는것 같았음. 그러고 바로 동거해봤음. 그때부터 헬이었음. 아버님이랑 그냥 안맞음. 노인정도 내려갔다가 바로올라오심ㅋㅋㅋ사건은 많았지만 결국 파혼선언하고 돌아섰는데 아버님이 자기 아들 결혼 못할까봐 포기하고 분가하심. 대출생김. 그리고 신혼 몇달동안 본인이 살던 집이니 며느리 혼자있는집에 오전에 막무가내로 문따고 들어옴...진짜 씻고있을때 그런적도있고 안방에서 몸말리고 있을때도 있어서 환장했던적이 있었음. 그때 당시엔 내집도 아니었었고 그래서 싫은소리 안했었는데 점점 노예 며느리 된듯 피빨아먹고 정신빨아먹고 그래서 몇번 손절침. 그래서 지금은 평소엔 연락안함. 참고로 친정 못살지 않음. 환경적이나 배움쪽이나 친정이월등함. 빈손으로 오라고 했지만 절대 안해가지도 않음. 많~~~이 해갔음. 대놓고 할말도 많음. 솔직히 비상용으로 번호 알려줄순 있지만....막 들이대면서 비번치고 들어오면 그냥 안살것 같음. 예의도 뭣도 없고...참고로 예전에 남편이 쉬는날에 사랑과전쟁보면서 일안하고 쉬고있는(?) 남편있었는데 와이프가 일나갔는데 장모님이 반찬싸들고오면서 문따고 막 들어오셨는데 사위가 소파에서 티비보면서 놀고있으니 맘에 안들어서 잔소리하고 먹은것좀 치우라고 잔소리하고ㅋㅋ그거보면서 출근하는 나한태 아!!!!저런 장모님이 있으면 같이 못살지!!!이래서ㅋㅋㅋ제가ㅋㅋㅋ그렇지????야.....!너네 아버지가 나한테 그랬어...이랬더니 한마디도 못하고 입꾹닫.
한국크루,츠바킬 떨어진거 아쉬워마라. 한국크루가 일본프로그램 나갔어도 젤먼저 탈락이여.
한사진,진짜 넘 예쁨 셀카도 되게 잘찍고 남이 찍어준 사진들도 다 잘나오고 포즈도 잘잡음 볼때마다 와 소리나옴 이둘은 상큼하고 되게 여사친 처럼나옴 암튼 내가 픽한사진 몇장만 올리고가께!!♡제일 좋아하는사진♡ 
행복대,충남대 이름 행복대로 바뀔수도 있음
행복대,충대 의대 다니는 과외쌤 피셜지금 충대랑 한밭대랑 통합 추진하고 있는데충대 이사장? 총장?이 정치쪽으로 나갈 계획이라 무조건 진행시키는 쪽으로 가고 있대그래서 한밭대가 이름 결정권 자기들한테 달라고 하거 있나봄그래서 지금 유력한 후보가 충남통합대(충통대)랑 행복대임 ㅅㅂㅋㅋㅋ..
행복대, 미안한데 그거 이미 끝난얘기임.. 행복대는 옛날에 공주대랑 통합할때 이름 행복대 될거라해서 이번에도 그렇게 되는거 아니냐고 에타에서 떠돌던거엿고… 한밭대랑 통합 이미 1학기때 무산됨
행복대,충남대가 최선인것 같은데.대학이름 인지도 쌓는데 몇십년 걸리는데 행복대로 바꾸면 졸업한 사람들까지 듣보 졸업생 될 듯.
행복대, 충통대 시 발ㅋㅋㅋ 행복대가낫네
행복대,"베댓에 물건너 갔다니 다행인 부분인데 사실상 충대>한밭대였고,한밭대는 원래 이공계전문 시립대였다가 국립대로 올라간지 얼마 안되서합치게 되도 충남대로 그대로 이름쓰게 하는게 맞지 않았나 싶음어차피 충북대도 있는데 개뜬금없이 행복대라는 명칭쓰면 어이털릴듯암튼 무산됐다니 각자 좋은(?) 결론을 도출했네지금은 어떤진 모르겠는데, 수능볼때 충대 평균 2등급은 나와야 들어가는 국립대라일반 지방대랑 차원이 다름."
행복대,행복대 말고 행복딱대 어떰
행복대,사실 사람들이 익숙해져서 그렇지   충남대 보다 행복대가 괜찮은 이름이해
행복대,행복대 ㅅㅂ 네임드 지거국에서 갑자기 지잡같아짐
효진초,효진초이 영상보고 생각나는건데 스우파1 리더끼리 한팀 스우파2리더끼리 한팀 되어서 배틀하면 개재미있을듯 올스타전 제발
효진초,미나명 본인은 독무 안가져가고 다 팀원들이랑 게스트? 나눠준거 너무 의외였음 있어도 신비나 효진초이랑 같이 센터서는 파트고.. 이래서 방방봐 하라는거임 엠넷의 편집에서 미나명은 책임감없는 가벼운 리더처럼 보여졌는데 현실은 반대잖아 사실 눈물많은 지랄수 캐해랑 방송에서 갈수록 시들시들해지는거 보고 나만의 개그캐였는데 이제는 실력적으로도 빠져버린듯.. 미나명 진짜 자꾸 눈길가고 신경쓰임 ㄹㅇ
힌다,안녕하세요 먼저 방탈 죄송합니다... 너무 스트레스를 받아 조언을 꼭 받고싶어요 ㅠㅠ+) 잠시 동거한 이유는 집천장에서 물이 심각하게 떨어지고 누수돼서 어쩔수 없이 집구할동안 같이 산겁니다 ㅠ 저랑 남친 둘다 타지역에 근무중이라 친구도 없고 가족도 멀어서 선택지가 없었어요 ㅜ 지금은 같이 안살아요.+) 핸드폰은 무조건 들고갑니다 제가 몇번이나 들고가지말라고 수십번 싸웠는데 안먹혀요+) 처음엔 저도 화장실 들어가서 너무 안나오니까 딴여자랑 연락하는게 아닌가 싶었는데 그건 절대 아니고(확인 다 했음) 그냥 웹툰이랑 유튜브 봐요저는 20대 중후반으로 남자친구와 4년째 연애중입니다.남친은 다른건 다 좋은데 똥을.. 하루에 적어도 세번은 싸는데 세번다 최소 30 길면 한시간동안 싸요.. 몇달전에 제 자취방에 문제가 생겨 세달정도 같이 산적이 있는데 남친이 똥 싸러 들어가려고만해도 제가 스트레스 받는 지경이 됐어요하루 24시간중에 잠자는 시간 빼고 나머지 시간중 세시간이 똥싸는 시간인게 말이 되나요??한시간 내내 똥이 나오냐고 물으니까 나온대요... 이게 너무 이해가 안돼서 같이 항문외과 간적이 있는데 치질은 당연히 있고 아직까지는 수술정도는 아니라네요. (여기서 조금만 더 심해지면 수술해야힌다고 함) 의사선생님말이 제 남친이 다른사람보다 소화가 3배정도는 빠르대요...집에 있던 밖에 있던 어디 가다가도 똥 마려우면 화장실 들어가서 삼십분은 안나와요 제가 어떻게 해야할까요...하루에 세시간동안 똥을 싸는게 말이 되나요... 아무리 식이섬유 치질약 소화 영양제 등등 먹어도 똑같아요 ㅠ 너무 스트레스 받는데 비슷한 경험 있으세요? 그냥 똥싸러간다는 소리만 들어도 짜증나요지금은 같이 안살아도 그냥 한동안 연락이 없으면 똥싸는건줄 아는 지경까지 왔습니다 +) 참고로 남친 입도 짧아서 식탐도 별로 없어요... ㅠ 군것질도 딱히 안좋아하고 밥은 일반인보다 덜 먹는데도 이래요...
