단어,포함된 문장
저작권법위반죄,"아이유 고발건 각하결정났대 정병들 고소나 쳐먹길  EDAM 엔터테인먼트입니다. 올해 5월경 성명불상자가 소속 아티스트 IU(본명 이지은, 이하 아티스트)를 저작권법위반 혐의로 고발한 사건에 대해 당사 법률대리인 법무법인(유한) 신원으로부터 해당 사건의 전체 경위 및 결과, 향후 법적 대응에 대한 내용이 담긴 보도자료 전문을 전달받아 유애나 여러분에게 공지합니다.  상세 내용 하단 참고 부탁드립니다.   가수 아이유(이하 ‘아티스트’라고 합니다)의 법률 대리를 맡은 법무법인(유한) 신원입니다.먼저, 성명불상자가 2023년 5월 경 아티스트를 저작권법위반 혐의로 고발하였던 사건(이하 ‘이 사건’이라고 합니다)에 대하여 8월 24일자로 각하 결정이 이루어졌음을 알려드립니다.이에, 당 법무법인은 다음과 같이 이 사건의 개요 및 문제점, 그리고 향후 대응 계획에 대하여 말씀을 드리고자 합니다. 1. 이 사건의 경위 아티스트는 지난 2023년 5월 10일 언론 보도를 통해 자신이 6개 음악저작물의 저작권을 침해하였음을 이유로 저작권법위반죄에 해당한다는 취지의 고발장이 서울 강남경찰서에 접수되었다는 소식을 접하였습니다. 본 법무법인은 5월 10일 즉시 고발장 정보공개청구를 진행하고, 5월 12일에 고발장 사본을 확보하여 고발의 취지와 그 내용을 파악할 수 있었습니다. 이후, 본 법무법인은 5월 15일 변호인 의견서를 제출한 것을 비롯하여 총 4회에 걸쳐 의견서를 제출하며 이 사건 고발이 법률상 근거도 갖추지 못한 것임을 강력하게 주장하였고, 결국 수사기관은 8월 24일 고발 사실이 범죄를 구성하지 않음을 이유로, “각하” 결정을 내렸으며, 본 법무법인은 8월 30일 수사결과통지서를 정식으로 수령하였습니다. 2. 이미지 훼손만을 목적으로 한 악의적인 고발에 대한 규탄의 필요성 본 법무법인은 8월 24일자 각하 결정에 맞추어, 아티스트와 함께 이 사건 고발의 문제점을 지적하고, 악의적인 고발 행태 및 아티스트를 향한 집단적이고 폭력적인 행위에 대하여 강력히 규탄하고자 합니다. 무엇보다 이 사건 고발인은 아티스트가 6개의 곡을 표절(저작권 침해)했다는 취지로 아티스트를 고발하였습니다. 그러나 이 사건은 고발인이 저작권법을 제대로 이해하지 못하였거나, 혹은 저작권법 규정을 이해하였음에도 단지 아티스트를 괴롭히기 위하여 악의적으로 강행한 사건에 불과합니다. 저작권법상 저작권 침해가 인정되기 위해서는, 어떤 저작자가 기존에 존재하는 다른 저작자의 창작물을 허락 없이 이용하여 그와 실질적으로 유사한 결과물을 창작해야 합니다. 즉, 고발인이 저작권 침해를 주장하는 것이라면, 무엇보다 최소한의 요건으로 6개 곡의 창작 행위(작곡)에 아티스트가 참여했다는 사실이 전제되어야만 하는 것입니다. 누구나 간단한 인터넷 검색을 통해 고발 대상이 된 6개 곡의 작곡가를 조회할 수 있으며, 이로써 그 중 5곡은 아티스트가 해당 곡을 창작한 작곡가가 아님을 명백하게 확인할 수 있습니다. 아티스트는 6곡 가운데 1곡의 작곡에만 참여하였는데, 해당 곡의 경우에도 고발인이 이 사건을 통해 저작권 침해를 문제 삼았던 부분은 아티스트가 참여한 파트가 아닙니다. 본 법무법인은 이러한 사실에 대한 증빙자료를 수사기관에 제출하였으며, 그에 따라 수사기관이 각하 결정을 내린 것임을 말씀 드립니다. 고발인은 저작권법상 작곡자가 아닌 아티스트가 관련 저작권 침해 분쟁의 당사자가 될 수 없음에도 불구하고 악의적인 고발을 진행하였습니다. 그리고, 아티스트가 이를 인지하기도 전에 언론을 통해 이 사건에 대한 내용이 먼저 유출, 보도되었고, 이후 ‘아이유 표절 의혹 고발’과 같은 제목으로 수백 여건의 언론 보도가 쏟아져 나오기에 이르렀습니다. 본 법무법인은 고발인의 이번 고발 행위가 최소한의 법률적인 요건과 근거도 갖추지 못한 채, 아티스트의 명예를 실추하고 정신적 고통을 주고자 한 행위 그 이상도 이하도 아니라고 판단합니다. 나아가 수사기관의 이번 각하 결정은 앞서 이 사건이 어떠한 법률적 요건도 갖추지 못한 채 악의적으로 이루어진 것임을 증명하는 것이며, 고발인을 비롯해 익명성을 이용하여 아티스트가 실제로 창작에 관여하지 않은 곡들에 대한 표절 혹은 저작권 침해 논란을 부추기는 주장들이 얼마나 터무니없고 악의적인 행위인지 명백하게 확인해주는 결과라 할 것입니다. 3. 이 사건 외에도 수년 째 이어지는 특정 무리들의 노골적이고 악랄한 사이버 불링(Cyber Bullying) 본 법무법인이 확보한 각종 제보 및 증빙자료 등에 의하면, 특정 무리들은 수년 전부터 아티스트를 조롱하고, 인격적 모욕을 가하며 괴롭히기 위한 목적으로 여러 이슈를 생산 및 유포해 온 것으로 확인됩니다. 이들은 갖가지 억측을 통한 ‘간첩설’, ‘대장동 주인’과 같은 허위 루머의 양산, 인신공격적 발언을 해왔으며, 지난해부터는 아티스트에게 가장 중요한 창작 영역에 대해서도 아티스트의 명예를 훼손하고자 이른바 ‘짜깁기 콘텐츠’를 생산하여 온라인 상에 게시하는 등 표절 논란을 부추겨 왔습니다. 위와 같은 무리의 소행에 유튜브, SNS, 블로그 등에서 이른바 ‘사이버 렉카(Cyber Wrecker)’의 행위까지 더해지면서 진위 여부에 대한 확인이나 검증도 없이, 자극적인 내용의 허위 정보가 확대, 재생산 되었으며, 이는 또 다시 인터넷상에서 불특정 다수가 아티스트를 집단적으로 괴롭히는, 이른바 ‘사이버 불링(Cyber Bullying)’으로 이어졌습니다. 그 결과, 아티스트 본인이 작곡하지 않은 곡까지 아티스트에게 해명을 요구하고, 심지어 아티스트의 곡 발표 이후에 나온 곡을 아티스트가 표절했다는 기묘한 주장까지 등장하였습니다. 이들은 악곡의 코드가 명백히 다른데도 불구하고 음의 길이나 키를 조작하여 비슷하게 들리는 몇 초 구간을 반복 편집하고, 자신들이 유사성을 제기한 곡의 작곡가에게 문의까지 하여 ‘억지 논란’을 부추기기도 하였습니다. 나아가 ‘표절로 보이지 않는다’는 작곡가의 답변을 받은 경우조차, 자신들이 악의적으로 편집하여 만들어 낸 ‘억지 논란’에 대해 아티스트가 해명해야 된다는 식의 주장을 이어갔습니다. 앞서 설명 드린 바와 같이, 어떠한 음악에 대한 이른바 ‘표절’ 문제가 발생할 경우, 필연적으로 저작권을 침해 당했다고 주장하는 작곡가 A와 후속곡을 창작한 작곡가 B 사이에 실제로 B가 A의 곡을 베껴서 창작한 것인지에 대한 논쟁과 논의가 이루어지는 것이 논리적인 순서라고 할 것인데, 아티스트를 둘러싼 ‘표절 시비’ 논란에서는 가창자인 아티스트에게만 비방 및 공격만이 이루어지고 있을 따름입니다. 최근까지도 지속적인 법적 조치를 토대로, 일부 악플러들에 대한 처벌이 계속 이루어지고 있으나, 이들 무리의 악랄한 괴롭힘은 ‘공익’이라는 미명 하에 더욱 교묘해지며 심각해지는 양상을 띠고 있습니다. 본 법무법인은 이 사건 고발 행위 역시 위와 같은 일련의 사태들과 무관하지 않은 것으로 판단하고 있으며, 이들에 대해 수집한 자료들을 수사기관에 전달하여, 다른 고소 사건과의 연관성 내지 공모 관계에 대해서도 적극 수사하여 줄 것을 요청하였습니다. 대중들을 현혹하고, 귀중한 언론 지면을 낭비하게 하는 이러한 행위는 최근 사회적으로도 심각성을 야기하고 있는 ‘사이버 불링’으로서, 아티스트에 대한 맹목적인 괴롭힘에 해당함이 명백한 바, 이러한 노골적이고, 잔인한 괴롭힘을 이제는 멈추어야 합니다. 4. 귀중한 수사 인력의 낭비 등에 따른 책임 촉구 본 법무법인은 단순히 누군가를 괴롭히기 위한 목적으로 사법제도를 악용하고 수사기관의 귀중한 수사인력마저 낭비하게 한 이 사건에 대해 엄중한 책임이 뒤따라야 한다는 입장을 명확히 밝힙니다. 이에, 차후 이러한 무분별한 고발을 방지하기 위하여 수사기관에서는 이 사건 고발인의 무고죄 성립 여부에 대하여 적극적으로 인지 수사를 진행하여 줄 것을 촉구하는 바입니다. 이와 함께 고발인이 이 사건으로 문제를 삼은 곡들의 작곡가들 역시 고발인의 몰지각한 행위로 인해 큰 충격을 받았으며, 고발인을 허위사실 적시에 따른 명예훼손 혐의로 고발하는 등 법률적 조치를 취하기 위한 방법을 강구 중에 있다고 전해 왔음을 알려드립니다. 본 법무법인은 현재 아티스트에 대한 악성 루머 및 게시글을 작성, 배포하고 있는 다수의악플러를 대상으로 한 추가 형사 고소를 준비 및 진행 중에 있으며, 이 사건 고발과 관련한 민사 소송 및 형사 고소 역시 빠른 시일 내 접수 및 진행 예정입니다. 앞으로도 본 법무법인이 보유하고 확보한 제보 내용 및 자료들을 바탕으로 일련의 악의적인 괴롭힘의 근원이 되고 있는 '사이버 불링'과 같은 폭력적이고 불법적인 행위를 묵과하지 않을 예정임을 말씀 드립니다. 감사합니다. "
정카,정카이... 설렌다
제베원,굿즈 포카 여러종 끼워팔아서 그걸 음반판매량으로 둔갑시키거잖아 시디는 1종만 발매하게 해야되고 굿즈 포카판매량 따로 집계해서 음반판매량에 포함 시키지말고음반판매량 = 포카 굿즈판매량이잖아시디는 1종만 취급해야함 법으로 규정좀 했으면 좋겠다데뷔한 신인이 100만장팔고 멤버 많은 남돌들 수십종 포카판매를 음반판매라고 500만장 언플하는것도 웃김비정상적인 음반판매로 둔갑시키지말고 1종으로 빨리 규정좀 정하자제베원 라이즈 에이티즈 아이브 스테이씨 시은 스키즈 세븐틴 있지 더보이즈 에스파 아이들 미연  비비지  블랙핑크 제니 로제 트레저 소미 뉴진스 르세라핌 카즈하 사쿠라 투바투 방탄 정국 뷔 진 지민  엔하이픈 권은비 최예나 이채연  
제주위, 가출해서 이혼해달라고 어느날 사람이 싹 바뀐 얼굴로 요구한다? 이건 그전부터 어떤 문제가 있었다고 봄.쓰니와의 문제는 없었는지 생각해봐야하고.제주위에 어떤남자분 가정에 엄청 충실하고 아이들한테도 처갓집에서도 엄청 칭찬받는 모범적인 남잔데 뒤에서는 여러여자와 바람을 피고 완전 다른사람으로 지내는데 부인은 모르는 눈치고 부인한테도 잘하고 하는데 어느날 불륜상대가 이혼하고 자기랑 사업도같이하고 같이살자 제안했다는데 거절했대요 그래도 이분은 가정을 지키고자 하는 마음이 엄청 강해서 애들과가정이 안깨진건데 님같은 경우는 남편분이 불륜상대에게 넘어간 케이스.자기 잘못이 적나라하게 파헤쳐질까 겁나서 숨어서 방어적 포복자세로 법원에서 보자고만 하는거죠.도장만 찍으면 깔끔하니까.자기 변명 구질구질한 불륜 안들켜도 되니까요.자기의 드러운불륜을 비난받기싫고 비판받기싫고 조리돌림당하는게 싫어서 법원에서만 보자는거임.완전 미성숙 그자체.
죽짱,착짱죽짱
준킬러,나 킬러 시간만 있으면 무조건 푸는데 앞에 준킬러 4점때문에 못풀어...글고 계산 실수 지림 ㅠㅠ 지금 현우진 풀커리 탔고 드릴 1회독 뉴런 / 시냅스 2회독함ㅠㅠㅠㅠ6모 2등급 나왔는데 방금 보고온 9모 장렬히 전사함...
지지안,저런사람이 후보라는데 민주당 국힘당이 무슨 상관이냐 이 나라좀먹는 무지성 국힘 지지자들아. 나도 굳이 민주당 지지안하지만 저런자가 후보라는데 민주당이 왜나오냐. 쌍팔년도에도 친구들한테 자리 하나씩 주는건 안했을듯.
지팔지꼰, 나라면 이 결혼 안해요.쓰니와 남자친구 금전감각이 이렇게 다른데 결혼하면 수렁에 빠질 것 같고 4억이 동네 개 이름인가요.남친 아프거나 사고나면 쓰니가 다 감당할 수 있어요?나는 이걸 보고 지팔지꼰이라고 합니다.
짱바투, 짱바투 
짱바투,짱바투 
쫄아,예전에 여친이 비슷한 경우가 있어서 떼인돈 받아드리는 사람인척 연락해서받아준적 있음 여친도 포기한상태라 아님 말고라서 그냥 함 해보자 들이대봄쫄아서 바로 입금해주던데 XX 캐피탈입니다 XXX씨한테 X월 X일 xxx빌린거 있으시죠?
쫄아,"예전에 어떤놈이 돈을 안줘서 (지인아님-물건값)이름,연락처,주민번호 알고있고 오늘까지 연락없으면 내일 경찰에 접수하러 간다.했더니 바로 입금 하던데용 전화해서 무슨 그깟걸로 경찰 얘기하냐고 난리 피더만 쫄아서 입금함 그래도 입금 안하면 경고했으니 접수하면되고 소액은 변호사 없이도 전자소송걸면끝협박이 최고"
차쥐뿔, 차쥐뿔 출연하는 날까지 오늘부터 기도한다
착짱,착짱죽짱
찰프, 남의 콘에서 신곡 공개는 안 하지 않을까찰프가 참여했으면 할 수도
찰프, 정국 올거같았어 찰프가 은근 티나게 말해서 ㅋㅋ 드디어 듀엣을 보는구나 그리고 디지털싱글을 왜 남의 콘에서 공개하겠어. 정국체급이 최고 잘나가는 팝스타인데. 무엇보다 남의 잔치에서 자기걸 왜 공개해 그냥 우정과 축하해주러가는거지
찰프,정국 올거같았어 찰프가 은근 티나게 말해서 ㅋㅋ 드디어 듀엣을 보는구나 그리고 디지털싱글을 왜 남의 콘에서 공개하겠어. 정국체급이 최고 잘나가는 팝스타인데. 무엇보다 남의 잔치에서 자기걸 왜 공개해 그냥 우정과 축하해주러가는거지
찰프,남의 콘에서 신곡 공개는 안 하지 않을까찰프가 참여했으면 할 수도
채영아, 채영아 여기서 뭐하냐 ㅋㅋ
채영아,채영아 여기서 뭐하냐 ㅋㅋ
청약홈,딴 얘기해서 죄송한데요.공인인증서 가지고 다른 정보가 다 나왔다는게 청약홈 말고 다른 금융권이나 카드사 등도 로그인 해봤다 맞나요?이혼도 생각중이라고 하시니 남편 동의없이 확인한거면 문제되지 않나 싶네요
최애의아,백현 팬들아 너희는 아직도 백현을 믿어?연예인을 믿어?진짜로 궁금해서.. 나는 애초에 연예인들을 안 믿음ㅋㅋ 얼굴에 분칠하는 사람들은 믿지마래최애의아이에도 아이돌은 그냥 거짓자체라던데 공감가더라
추반용,추반용 
치팅데,"10키로 뺀 유지어터예요!정말 쉽게 살을 빼서 공유해주고 싶어서 로그인까지 했어요1. 기상 후 따뜻한 물 한잔 마시기- 새벽에 먹고 싶은 음식을 참았다거나, 전날 먹고 남은 맛있는 음식이 있으면 입으로 직행해는 사람이 저였는데, 가장 먼저 따뜻한 물을 마시자~ 하는 마음을 먹었어요. 음식은 따뜻한 물 먼저 마시고 나서 먹으면 돼~ 하며 여유롭게 생각하니까 잘 안먹게 되더라구요? 먹더라도 조절도 좀 더 쉽구요! 2. 16:8 혹은 12;12 간헐적 단식하기-저는 16:8을 하고 있지만 쓰니의 경우 힘들 수 있어요. 처음엔 12:12정도로 가볍게 시작하는걸 추천해요!(격일단식, 폭식 후 단식, 3일단식 금물!!!절대 금물!!!!) 마음 가짐도 지금은 단식 시간이니까 못먹어 ㅜㅜ 하는게 아니라 내 몸이 쉴 시간을 주고 있다고 생각하면서 여유롭게 마인드컨트롤하면 보상심리가 줄더라구요3. 간식 생각 날 때 먼저 따뜻한 물부터 마시기-이것도 1번 방법과 비슷한 방법이에요. 안먹어야해!!하는 마음이 들 때부터 폭식의 시작인거잖아요? 그러니까 순서를 바꾸는 거에요 일단 먼저 따뜻한 물 마시고 나서 생각해보자~ 하며 다독여주면서 간식의 유혹을 이겨내봐요! 10번 중 6번정도는 간식 생각이 사라지더라구요~!4. 치팅데이 절대 금물! -여기서 헉!! 할 수 있을거같아요~ 맛있는 음식을 먹지 말라고 하는 게 아니라 다이어트 중에도 먹고 싶은 음식을 맛있게 즐기는거에요~! 양을 줄여야한다는 강박도 그냥 버려요! 다이어트 초반 때는 면,빵 이런 음식들이 많이 생각나서 먹었던 것 같아요 저도! 먹되 천천히~ 음미하면서 내가 지금 배부르지 않은지? 체크 후 배부르다면 젓가락 내려놓는 연습을 했어요!5. 간헐적 단식이 익숙해진 후에 저녁 한끼만 닭가슴살 비빔밥으로 대체해보기!-여기서 중요한 포인트는 간헐적 단식이 익숙해 진 후!!!라는 거에요! 간헐적 단식도 어려운데 저녁까지 다이어트 식으로 먹어야해?ㅜㅜ하는 마음은 금물!! 익숙해질 때까지는 점심엔 정말 아무거나! 먹고 싶은거! 저녁에는 단백질 위주의 일반식 돼지국밥에서 건더기 위주╋밥/ 고기구워서 쌈싸먹기 등등 맛있는거 먹다가! 이제 좀 몸이 적응한다고 생각하면 샐러드 야채 ╋ 계란후라이 ╋ 현미밥 반공기 ╋ 고추장 넣어서 비벼먹어봐요! 정말 맛있어요!! 그렇게 한 끼는 몸에 건강한 음식으로 채우면 또 성취감도 올라가고 너무 좋아요! 쓰니에게 조금이라도 힘이 되고, 팁이 되었으면 좋겠네요!! 외적인 요소 아니더라도 살 빼니 너무 몸도 가볍고 움직일 맛이 나더라구요?!? 너무 어렵게 생각 말고 천천히 꾸준히 해보자구요!!"
칼차단,여자 생긴 것 같은데 오래 못 갑니다그런 여자의 습성은 돈 없는 남자 오래 안 만나거든요지금이야 퇴직금의 월급의 지인에게 빌린 돈이 있어서 서로 꿀단지 핥으면서 좋은시간 보내겠지만  조만간 돈  다 쓰고 나면 여자는 떨어져 나가게 돼 있음 혹여나 잘못 했다고 싹싹 빌며 다시 살자고 할수 있으니 정신 쳉겨서 잘 정리하시고 칼차단 하시길
코어룩,발레코어룩이 유행이람서
코어룩,요즘 발레코어룩 유행이라길래 외국언니들 코디 찾아보니까한번쯤 해보고싶어서 따라해봤어..^^신발끈 대신 리본으로 묶어봤는데약간 요런 느낌 리본이랑 신발이랑 깔 맞춤 해봤는데 어뗘?  
퀸동주,이 아이돌 ㄹㅇ 퀸동주 닮지않았냐….?
퀸동주, 엔터에 올리기엔 팬들한테 욕 뒤지게 먹을 것 같아서…아니 근데 진심 약간 퀸동주 느낌 나지않냐?ㅈㄴ 깔끔하게 씻고 예쁘게 화장 잘 한 퀸동주 업그레이드 킹동주 이런 느낌 캌투 
퀸동주, 이쯤되면 퀸동주 슴상인듯 
퀸동주, 퀸동주 입이 돌출이라 그렇지 스엠 특유의 귀염상이라 그런듯
퀸동주,퀸동주 돌출입 수술만 하면 비율도 좋고 볼만함;
퀸동주,이것도 태연 사진이라는데 첨에 퀸동주인줄 알았음ㅋㅋ 퀸동주 스엠상 맞네 
퀸동주,와 나 퀸동주 그 정서가 나랑 너무 안 맞아서 다 차단해놨거든? 근데 베댓 사진 보고 다큐 보고 왔다가 울었음 ㅅㅂ ㅜㅜㅜㅜ 얼굴도 어릴 땐 귀여웟는데 사랑 충분히 받고 왕따 안 당하고 살았으면 지금 좀 달라지지 않았을까 싶음
퀸동주,퀸동주가 누군데 ㅡㅡ
클럽충,거봐 지민 악개들이 댓글에서 클럽 지민이가 해놓고 또 정국이한테 뒤집어 쒸우자나 지들 욕 안먹으려고 ㅋㅋㅋㅋ파리 클럽에서 팬도 아닌 여자랑 놀다가 걸린거 지민이고정국이는 97 친구들이랑 논거고 걍 노양심 새끼들임ㅋ방탄 클럽충은 공식적으로 ㅈㅁ입니당 다른 멤버들한테 그만 떠넘겨 망구들아
클럽충,전정국악개줌냐 뷔까는척 지민이랑 개정국 쳐엮는거봐ㅋㅋㅋㅋㅋㅋㅋ커플문신-입건송치-뒷광고-클럽충 개입건 개같이 패줄게
타그룹,무려 방탄 메본데 데뷔 10년만에 첫 솔로 출격이라니 넘 늦은 감은 있음 타그룹 메보들은 빠르면 2~3년만에도 솔로 활동 병행하고 ost같은 외부 작업도 흔하게 하는데 다른 메보들은 다 한번씩은 해봤다는 영화 드라마 ost하나 없었자나 그나마 망한 방탄 웹툰 억지로 설득해서 ost 부르게한거 밖에 없음 솔로 나오자마자 이렇게 훨훨 날아다니는 애를 그동안 꽁꽁 숨긴게 새삼 아깝다
타그룹,솔직히 올해 데뷔한 타그룹들에 있는 성찬이나 김지웅같은 정석미남상이 없어서 그렇지 구멍은 없지않나..? 리우 운학두명 씹덕상에 나머지 네명도 잘생김..
탕후루립,알리 익스프레스를 가입했더니 첫구매 혜택으로 500원에 물건 세 개를 살 수 있었삼 (아무거나는 아니고 오백원으로 살 수 있는 물품이 정해져 있음)그래서 산 것들...중국산 제품 못 믿겠는 애들은 패스하셈미방1. 화장품 서랍내 화장품은 아주 단촐하기 때문에 거의 다 수납가능했음값싼 플라스틱 재질이긴 한데 오백원주고 샀으니까 뭐.. 이정도면 나름 쓸만함2. 립글로즈후기에 장원영 입술 된다길래 샀음애기들 공주놀이 할 때 쓰는 장난감 재질임 양 개적음반짝이 같은 거 들어있고 바르면 입술 반짝반짝해지긴 함ㅋㅋ 기름 묻은 것처럼 미끈거리는 거 싫어하는 애들은 비추 중국산 제품이라 불안한 애들도 걍 거르셈 근데 틴트 위에 바르면 탕후루립 ㄱㄴ이라 가끔 쓸 듯3. 이름모를 틴트약간 페리페라 벨벳틴트st임 입술 쌉건조해져서 각질제거 잘 하고 발라야됨 발림성 나름 ㄱㅊ머.. 솔직히 걍 흔한 로드샵 매트틴트랑 뭐가 다른 지 잘 모르겠음 약간 싼 화장품 특유의 냄새 달달한 냄새가 남총평... 애초에 이 가격에 멀쩡한 게 올 거라고는 기대 안 했고 장난삼아 사 본 것 치고는 생각보다 ㄱㅊ천오백원치로 처음 해외배송 경험을 해 봄... 끝
투바투,굿즈 포카 여러종 끼워팔아서 그걸 음반판매량으로 둔갑시키거잖아 시디는 1종만 발매하게 해야되고 굿즈 포카판매량 따로 집계해서 음반판매량에 포함 시키지말고음반판매량 = 포카 굿즈판매량이잖아시디는 1종만 취급해야함 법으로 규정좀 했으면 좋겠다데뷔한 신인이 100만장팔고 멤버 많은 남돌들 수십종 포카판매를 음반판매라고 500만장 언플하는것도 웃김비정상적인 음반판매로 둔갑시키지말고 1종으로 빨리 규정좀 정하자제베원 라이즈 에이티즈 아이브 스테이씨 시은 스키즈 세븐틴 있지 더보이즈 에스파 아이들 미연  비비지  블랙핑크 제니 로제 트레저 소미 뉴진스 르세라핌 카즈하 사쿠라 투바투 방탄 정국 뷔 진 지민  엔하이픈 권은비 최예나 이채연  
투바투,투바투 신곡 미쳤어
투바투,"진심...이 갈았나봐TOMORROW X TOGETHER, Anitta - 'Back for More (with Anitta)' - 투바투 VMAs 퍼포먼스 확정인데 VMAs에서 무대 첫공개 예정임 미 4대 시상식에서 신곡 선공개 폼 미침 ㅋㅋㅋ 짧게 공개된 부분 미쳤으니까 속는셈치고 한번봐봐https://twitter.com/txt_sarangdan2/status/1698714116356247698?t=Sx0avADyJSNmXS-UHn6dyQ&s=19 "
투바투, 투바투 저렇게 밀어주는데 성공해야지 ㅋㅋㅋ
투바투,투바투 정병 한두명이 일당백하잖아ㅋㅋㅋㅋㅋ나중에 보면 댓글 다 삭제되어있음 투바투글에서 시간낭비하면 진짜 투바투가 망하기라도 하나;;;
투바투,투바투노래가 좋긴해
투바투,고척기념으로 다시보는 투바투 스미콘 연출
투바투,스미콘 끝나고 트위터에서 알티타면서 연출 좋기로 소문난 투바투 콘서트고척에서 더 화려하고 웅장해질거 생각하면 벌써부터 기대된당
투바투, 콘서트비용 비싼거 아는데.. 투바투는 진짜 돈 안아까움 
투바투, 투바투 콘 규모 체감짤 ㅋㅋㅋㅋ어디까지 클래 진짜 ㅋㅋㅋ 
투바투,지금은 팬아니긴한데 작년 럽식콘 간이후로 다른 콘서트 두번 갔었는데 만족이 안됨.. 투바투 노래도 다 좋고 벅차오르는 노래가 많아서 더그런듯 너무 재밌었어 두밧두 와리와리할때 ㄹㅇ 울뻔함 
투바투,내가 투바투 정병이면 개빡칠듯ㅋㅋㅋㅋㅋㅋㅋㅋ개웃기네
