단어,포함된 문장
개쩖, 뷔 놀리면 타격감 개쩖 너무 웃김
구사옥, 예전에 내동생이 방탄 빅히트구사옥 그 근처 회사에서 일했거든? 울동생이 방시혁은 ㅈㄴ 많이보고 방탄은 딱 한번 봤다는데 울동생이 뷔 진은 찐 잘생겼다함.. 아직도 내 동생은 뷔 진은 찐이라고 나한테 말함
구욧,집 비밀번호는 남편 나 친정식구들만 알아야 하는거라구욧
그나물,저 여쟈 저렇게 키운 부모나 저여자 며느리로 들인 시부모나 데리고 사는 남편 등 주위 친인척들은요??  그밥에 그나물이죠?????? 와…………………
그자세,"제 남편이 그래요. 폰 뺏으니 20분만에 나옵니다. 폰게임하면서 똥 싸고 놀다가 또 똥싸요. 흠,,제가 똥싸러 와리가리하는 타입인데 한번 된걸 조금싸면 남편따라 기다리는데 제 생각엔 깁니다. 나오지요. 3분?  안되서 또들어가서 본 타임을,,그리고 나왔다가 5ㅡ10분?  또 가요. 전 화장실 오래 못앉아있어서 와리가리하는데 남자들이 이걸 하는거지요. 그래서 치질에 걸립니다. 왜냐. 변기에서 조금만 힘주면 똥구녕이 열리거든. 그자세를 계~~~~~속하니 치질도 나오 고 싶겠지. 그래서 제 남편은 결혼하자마자 수술 했어요. 15년전인데 그래도 안고쳐요. 전 다음에 화장실 3개있는집 사달라했어요.  하나는 온전히 나만 쓰게. 창피해서 친정 안데려갑니다"
그해울,뷔 목소리좋아 이런 스탈 많이 해주면 좋겠어 그해울오스트도 좋았는데
글내용, 이효리도 화사 후배지만 가수로써 존경한다고 하고  선후배 가수들이 화사 무대랑 노래 잘한다고 샤라웃 엄청 하던데 글내용 웃긴다ㅋㅋㅋㅋㅋ
글삭, 애들아 얘 ㅇㄱㄹ같으니깐 일단 추천 누르지말고 댓달지 말아줘 화보에서 발렌시아가 착장으로 나와서 짹에서 걍 팬들끼리 엠버서더하나 궁예한걸 공식나온것 마냥 글써놨네ㄷㄷ 팬맞고 ㅇㄱㄹ끌거 아니면 글삭하거나 수정해줘. 이런건 공식나와서 확실할때만 쓰는거임 ㅁㄱ 
글삭, 글삭을 해줘 아니면 수정을 해주고 ㅇㅇ 아직 그게 피셜도 없을뿐더러 그냥 궁예이니까 ㅁㄱ할게
글삭,애들아 얘 ㅇㄱㄹ같으니깐 일단 추천 누르지말고 댓달지 말아줘 화보에서 발렌시아가 착장으로 나와서 짹에서 걍 팬들끼리 엠버서더하나 궁예한걸 공식나온것 마냥 글써놨네ㄷㄷ 팬맞고 ㅇㄱㄹ끌거 아니면 글삭하거나 수정해줘. 이런건 공식나와서 확실할때만 쓰는거임 ㅁㄱ 
글삭,글삭을 해줘 아니면 수정을 해주고 ㅇㅇ 아직 그게 피셜도 없을뿐더러 그냥 궁예이니까 ㅁㄱ할게
기여움,뭔가 하는짓이 순수하고 꼬물거려서 댕댕이같음 ㅈㄴ 기여움 받을 스타일
기종인,감동적인데 아이폰 무슨 기종인지도 궁금함 ㅋㅋ
뇌절개, 뇌절개심한데... 저런거야 팬아니고선 알바없는 일아닌가 뭣도 아닌게 왜 저런식으로 조롱할 권리가 있다고 생각하는건지
뇌절개,뇌절개심한데... 저런거야 팬아니고선 알바없는 일아닌가 뭣도 아닌게 왜 저런식으로 조롱할 권리가 있다고 생각하는건지
뉴아르,뉴아르좀 냅두세요 씹마님들아
뉴진스혜,"난 개인적인 취향으로 나연 예쁘다고 생각한적 없었는데새삼 진짜 예쁘고 상큼하구나분위기 진짜 좋다댓글에 올라온 사진들은 약간 뉴진스 혜인 그런느낌도 난다무슨말일지 모를수 있겠지만 뉴진스혜인, 나연, 김민희 그런 뭔가 볼살 통통한듯 예쁜느낌 (불륜녀 옹호X..)"
다른걸,"이그.. 4주동안 앓았으면 코로나말고 다른걸 의심했어야죠.요샌 열╋기침이면 거의 독감뜨더라구요. 어린이집 다니면 애들 사이 유행하는 바이러스 어른이 옮아서 아프기도 하구요. 무슨 사정인지는 모르겠으나 내년부턴 일하신다니 드리는 말씀입니다. 애 아프면 봐줄데가 있나요? 복직하는게 아닌 신입으로 일 들어가면 애 아플때 일빼기 쉽지 않을겁니다. 연월차도 거의 없을테구요. 저도 남편이 주야간하고 저는 9~6근무인데 서로 최대한 애들 챙기는건 수시로 연락해서 조율해가며 삽니다. 맞벌이를 시작하면 외벌이때보다 시간적 여유가 없어져서 늘 시간에 쫓기게 되고 난감한 상황이  많이 발생하게 됩니다. 남편분 많이 피곤하실 겁니다. 주야간근무 번갈아가는건 신체리듬이 완전 깨져서 몰아서 자도, 쉬어도 늘 피곤한 모드라 보심돼요. 저도 야간근무 끝나고 퇴근하는데 내가 출근을 하는지 퇴근을 하는지 잠깐 멍때렸던 적이 있을정도니까요. 이제 님도 일 하실날이 머지 않았는데 쉬다 일하시니 익숙치 않으시고 적응하시느라 많이 피곤하실거에요. 애가 있어서 초반엔 많이 싸우게 됩니다. 마음의 준비 단디 하시고 영양제 챙겨먹어가며 힘내세요^^"
더기버스,판 메인에 뜨니까 더기버스 직원들 헐레벌떡 달려와서 댓글쓰네 ㅋㅋ 에라이
더기버스,더기버스 백진실 안성일 깜빵 가야함 ㄹㅇ전대표님 응원합니다
두팀, 원밀 잼리퍼블릭 두팀 제일 잘함.  조회수도 넘사벽
두팀, 난 안무 영상 미션도 그렇고 구리다고 생각했어. 케이팝도 잘했다고?? 난 일본인인지 모르고 봤을때 옷 왜 이래…안무 왤케 옛날 사람들 같아…이 생각 했어. 울풀러는 손발이 안맞고 심각해서 꼴찌가 이 두팀일쥴 알았음
두팀,난 안무 영상 미션도 그렇고 구리다고 생각했어. 케이팝도 잘했다고?? 난 일본인인지 모르고 봤을때 옷 왜 이래…안무 왤케 옛날 사람들 같아…이 생각 했어. 울풀러는 손발이 안맞고 심각해서 꼴찌가 이 두팀일쥴 알았음
딥앤딥,난 베베 딥앤딥 별루 바다 자체는 좋은데 팀으로썬 그닥 메가크루 조회수 낮네 남자들이랑 하는 미션??이랑 겹칠듯
딴나라,라이브 안 할거면 딴나라 나가지마라 쪽팔림
딴세상,댓글이 다 딴세상이네ㅜㅜ 난 먹고살기 빠듯한데
랜다, 일간 25위로 올라갔고 실시간 10위대까지 올라서 계속 정주행중인데 얘는 왜 24시간 다 들어가지도 않은 첫날 진입 순위를 올림?ㅋㅋㅋㅋ  화사가 음치랜다ㅋㅋㅋㅋㅋㅋ 
리더계급,솔직히 리더계급 춤 일반인이 추면 그 맛이 안 살더라..대중성 없다고 해야하나.. 라트라스가 만든 안무가  일반인이 춰도 쫀득하게 잘 만든거같음
리더계급,"마네퀸 음.. 처음엔 호도 비호도 아니였는데갖고 있는 실력들이 좋은데도 불구하고 우리가짱이야 우리만 돋보여야돼 이런 마인드로 미션해서 비호가 된듯 시즌1 라치카처럼 배틀러라고 욕심이 많아서 그렇다고 하는데 이게 배틀만하는 프로그램은 아니잖슴..? 계습미션에서 왁씨 윤지가 너무 노래에 찰떡인 좋은 안무를 짰음에도 불구하고 오드리빼고 나머지를 진짜 그냥 자신들 백업댄서로 만들어버려서 뮤비도 망한게 그 예임.. 다른 계급처럼 다들 파트 분배해줬으면 리더계급 정도 이슈됐을거같은데 케이팝미션도 뭐 이기고싶어서겠지만 마네퀸만 안무 갈아엎어버리고,, 메가크루도 립제이까진 딱 좋았는데 세라독무도 그렇고  뒤쪽은 게스트를 너무 많이 불러서 산으로 간 기분그냥 마네퀸만의 실력으로 제대로 한번 보여주는게 마네퀸한테 더 좋을듯!!"
리더계급,미나명 리더계급 리아킴 안무 평가할 때도 자기 감정 제외하고 딱 평가만 하더라 리아킴이 계속 실수하는 것도 비웃을만 한데 이유를 알아서 그런지 차분하게 지켜봐주는 느낌이었음..
립제,"마네퀸 음.. 처음엔 호도 비호도 아니였는데갖고 있는 실력들이 좋은데도 불구하고 우리가짱이야 우리만 돋보여야돼 이런 마인드로 미션해서 비호가 된듯 시즌1 라치카처럼 배틀러라고 욕심이 많아서 그렇다고 하는데 이게 배틀만하는 프로그램은 아니잖슴..? 계습미션에서 왁씨 윤지가 너무 노래에 찰떡인 좋은 안무를 짰음에도 불구하고 오드리빼고 나머지를 진짜 그냥 자신들 백업댄서로 만들어버려서 뮤비도 망한게 그 예임.. 다른 계급처럼 다들 파트 분배해줬으면 리더계급 정도 이슈됐을거같은데 케이팝미션도 뭐 이기고싶어서겠지만 마네퀸만 안무 갈아엎어버리고,, 메가크루도 립제이까진 딱 좋았는데 세라독무도 그렇고  뒤쪽은 게스트를 너무 많이 불러서 산으로 간 기분그냥 마네퀸만의 실력으로 제대로 한번 보여주는게 마네퀸한테 더 좋을듯!!"
립제, ㄹㅇ연예인그만써.. 댄서들이 주인공이라면서 연옌 ㅈㄴ부름 립제이까진 개좋았는데 ㅠ
립제,립제이는 그래도 잘 섭외한듯
립제,못생긴 립제이는 되고 예쁜 윈터는 ㅈ같다네~~~~~
립제,마네퀸이 제일 쩔더라 댄서들 매력 실력도 다 살렸고 립제이 부분은 강렬함은 윈터 부분은 신비로움을 보여줘서 적재적소에 잘 넣은거 같고 너무 좋았음
망왑퀴,망왑퀴들 또 바이럴..ㅋㅋㅋㅋ 추천조작좀 작작해라
백진실,더기버스 백진실 안성일 깜빵 가야함 ㄹㅇ전대표님 응원합니다
버님,우리 시어머닌 화학조미료안쓰신거에 자부심 뿜뿜이심^^맛소금도 안쓰심~~이번 설날 작은아주버님께서 시어머시께 음식 남는다고 우리한테 뭐라하지말고 제발 차례때라도 조미료 좀 쓰라고~ㅋㅋㅋ적당히 쓰면 맛 좋은 음식~올 추석엔 조미료 사놓으셨을랑가~~~
버님,나 결혼할때 생각남. 남편이름으로 자가있었고 빚없댔음. 그리고 이름있는 회사다니고 빚없이 자차 있댔음. 대신 홀시아버님 모시고 살아야한댔음. 노총각 아들 결혼 못보내서 걱정많은 아버님이었음. 남편보다 두살 연상분이 남편 보고 깐적있음...엄마가 주선자라 내가 내막을 살짝 알고있음.. 있을거 다 있으니까 빈손으로 와도 된댔음. 본인 9-6시까지 노인정에 있을거고 점심도 거기서 먹을거니까 신경쓸거 많이 없을거라했음. 전업해도 괜찮다고 했음. 그때 내가 일년 이상 놀고 있었음. 벌어논 돈도있었고 솔직히 외모가 좀 괜찮은 편이기도 했었음.  나는 성격도 좋아서 어르신 잘 모실수도 있다 생각했음. 선한번 봐볼까 해서 봤는데 외모는 진짜 내취향이 아니었지만 뭔가 성격이 잘맞는것 같았음. 그러고 바로 동거해봤음. 그때부터 헬이었음. 아버님이랑 그냥 안맞음. 노인정도 내려갔다가 바로올라오심ㅋㅋㅋ사건은 많았지만 결국 파혼선언하고 돌아섰는데 아버님이 자기 아들 결혼 못할까봐 포기하고 분가하심. 대출생김. 그리고 신혼 몇달동안 본인이 살던 집이니 며느리 혼자있는집에 오전에 막무가내로 문따고 들어옴...진짜 씻고있을때 그런적도있고 안방에서 몸말리고 있을때도 있어서 환장했던적이 있었음. 그때 당시엔 내집도 아니었었고 그래서 싫은소리 안했었는데 점점 노예 며느리 된듯 피빨아먹고 정신빨아먹고 그래서 몇번 손절침. 그래서 지금은 평소엔 연락안함. 참고로 친정 못살지 않음. 환경적이나 배움쪽이나 친정이월등함. 빈손으로 오라고 했지만 절대 안해가지도 않음. 많~~~이 해갔음. 대놓고 할말도 많음. 솔직히 비상용으로 번호 알려줄순 있지만....막 들이대면서 비번치고 들어오면 그냥 안살것 같음. 예의도 뭣도 없고...참고로 예전에 남편이 쉬는날에 사랑과전쟁보면서 일안하고 쉬고있는(?) 남편있었는데 와이프가 일나갔는데 장모님이 반찬싸들고오면서 문따고 막 들어오셨는데 사위가 소파에서 티비보면서 놀고있으니 맘에 안들어서 잔소리하고 먹은것좀 치우라고 잔소리하고ㅋㅋ그거보면서 출근하는 나한태 아!!!!저런 장모님이 있으면 같이 못살지!!!이래서ㅋㅋㅋ제가ㅋㅋㅋ그렇지????야.....!너네 아버지가 나한테 그랬어...이랬더니 한마디도 못하고 입꾹닫.
병크돌,병크돌이 잘못한거지ㅜ
생각함,냉정하게 케이팝 미션으로만 따지면 츠바킬이 합이 잘 안 맞아서 제일 눈에 안 띄긴 했는데 종합적인 역량으로 따지면 딥앤댑이 탈락했어야 한다고 생각함 츠바킬 개개인 포텐이 너무 높았어서 아쉽다ㅠ
생각함,"난 오히려 울플러가 탈락배틀 간 게 더 말 안 된다고 생각함 울플러 vs 원밀리언 보면 취향 차이지 둘 다 잘 했음 솔직히 츠바킬vs 베베는 누가봐도 베베가 훨씬 잘 했는데, 논란 생긴 게 더 의아함 프로그램 반영 후에 투표했어도 베베가 이길거라고 생각함"
생각함,난 바다랑 커스틴이 매력있다 생각함 근디 오드리가 호불호가 많이 갈리는거 같음...
생각함,남편 잘생김 상냥함 요리잘함 성격다맞춰줌 배려짱 돈잘범 든든함 24시간붙어있음 애교많음 해달란거다해줌 내말이면 법이라고생각함 돈많이써도신경안씀 지껀안사도내껀사줌 책임감강함 시집스트레스사전차단해둠 전 안갑니다 명절에도 남편이랑 친정집감ㅎㅎ 투자내맘대로해도 신경안씀 뭘해도 나를 믿어줌ㅎㅎ 출산은 내가원하는대로 할수있게 모든선택지를줌 애낳고싶으면 몸상하지말고 대리모쓰라할정도ㅋㅋㅋ 건강신경엄청써줌 밤일잘함
생각함,"제곧내임.나는 여자인데 요즘 여자들이 좋아하는 음식 순위에떡볶이, 닭발, 곱창, 마라탕 얘들이 1~4위야나는 정말 저 4가지 음식 싫어함.차라리 남자들 순위인 돈까스, 제육 이런게 나음.내가 저거 싫어한다면 다른 여자사람들이 이상하게 생각함.-------------------------------------------------------추가로 나는 신맛 커피보다 고소한 커피가 좋고스테이크도 레어나 미디움보다미디움웰던이나 웰던이 좋음.그런데 꼭 저렇게 먹으면 촌스러운 사람처럼 생각함.그냥 취향인데 취향대로 존중해줬으면 좋겠어취향까지 유행대로 흘러가지 말길. "
생각함,"애초에 남 고기굽기 보면서 대놓고 촌스럽다고 할 정도의 그룹이면 걍 니 친구들 수준이 ㅈㄴ낮은거 아님..? 나도 핏물 떨어지는거 비위 상해서 회, 내장, 레어 절대 못 먹는데 아무리 친해도 살면서 웰던 먹는걸로 촌스럽다고 한 사람 정말 단 1도 없었음. 속으론 생각할 수 있어도 겉으로 그러는건 걍 너가 만만한거임. 물론 만만해도 그럼 안 되는거지만. 예를 들어 이재용 딸이 웰던으로 먹는다고 해서 촌스럽다고 할 사람 있을까? 그냥 그 사람 인식에 맞춰서 행동을 판단하고 보는거라 생각함"
생각함,이게 진짜인게 몇년전에 알바하다가 말섞게된 중년여성분이 강아지 키우냐고 물어보더니 자기 아들이 요새 강아지에 관심이 너무 많아졌다고 몇일만 데리고 있게 좀 주라고 함... 난감해하니까 계속 조름 이런식으로 몇번 더 조르셨는데 세상에는 별의별 사람이 많구나 생각함
생각함,뷔 진짜 잘하던데 그래도 이런 엔딩 감성은 정국이가 더 잘 어울렸다 생각함
생각함,뷔 ㅈㄴ잘생겼다고 생각함
생각함,조롱당할만한 실력은 아닌데 그렇다고 개잘한다고 영업하기엔 무리가 있음 애초에 비주얼멤이니까 비주얼멤 능력치는 한다고 생각함
생각함,진짜 말도 안 돼.....누가봐도 떨어질 실력이 아님 케이팝 미션 베베랑 붙고 방송 전에 유튜브로 평가해서 그렇지 츠바킬 케이팝 미션도 개잘했고 배틀도 잘했는데 하필 배틀 상대가 울플러.... 방송하고 공개되기만 했어도 츠바킬 탈락배틀은 안 갔음 걍 세상이 츠바킬을 억까함 난 츠바킬을 더 보고싶은데ㅜ 솔직히 모두가 생각하는 그 팀이 떨어지는 게 맞다고 생각함
생각함,뭔가 잘생긴 사막여우같이 생기지 않았나 볼때마다 동물 사막여우 닮았다고 생각함
서사맛집,첫화보고 이거보니까 와 서사맛집이네..미나명은 인정하기 싫겠지만 둘이 찰떡인듯
성잘,이런 부모 밑에서 커서 정서적으로도 안정되고 타인에게 친절한 사람으로 성잘할듯.나이 드니 돈 많은 부모보다 이런 부모 가진 사람들이 정말 부러움..
소름쫙,난 원밀... 미친거같음 소름쫙
슈취타, 뷔 춤도 잘 추고 얼굴도 잘생긴 올라운더맞음ㅋㅋ 슈취타에서 슈가가 그랬잖아 뷔 3옥타브 뚫었다고... 근데 재즈곡 커버할땐 동굴저음까지 다 가능
스맨파,"딥앤댑은 초등학교 때 췄던 부채춤 생각나는 동선임,, 국뽕 자극하는 한국무용 졸업작품 느낌인데 다들 극찬하니깐 당혹스러움,, 메가크루 미션은 원밀이 압살임,, 잼이 여건상 불리했던것 빼면 다른 팀들도 다 잘했는데 베베는 ㅜㅜ 카메라 보고 인상쓰는 것 좀 그만했으면 좋겠음,, 바다도 은근 자기복제 심함,, 춤은 안보이고 머리에 손 올리고 인상쓰는것 밖에 생각 안남.. k팝 미션에도 썼던 발 매다는거랑 이미 스맨파 스우파에서 자주 나오는 뒤로 넘어가는 테크닉을 베베가 또 보여주니깐 개진부했음"
스맨파,같이 춤 추는것도 아니고 중간에 5초 나와서 얼굴 비추고 나가던데진짜 퍼포 자체도 조회수용으로 아이돌 불렀다고 어그로 끌리기 딱 좋게 짜놓음…아니 진짜 왜..???차라리 아예 댄서로 참여 시키던가스우파1이나 스맨파는 아이돌도 다 춤 추고 퍼포 참여했는데ㅜ왜지..? 
스맨파, 너무 조회수용인거 같아서 좀 그럼.. 스맨파 원밀도 난 갠적으로 그랬음
스우파,스우파2 4화 과몰입하자!
스우파," 모니카도 스우파 1때 판정 때문에 힘들어했으면서 결국 본인도 저지 되니깐 씬에서의 인맥이랑 댄서들 이름값만 보는것 같음,, 경연이라는 이름으로 방송할거면 적어도 부끄럽지 않게 국뽕 다 빼고 정확하게 판정했으면 좋겠음,, 모니카는 울플로랑 마네퀸 참 좋아하는듯,,"
스우파,유튜브 스우파 공식채널 댓글 츠바킬 징징댓글로 뒤덮인거 진짜 소름이네그것도 그거고 잼리퍼블릭 메가 크루 미션 한국에서 찍어서 불리하다니 지원이 부족하니 어쩌고 저쩌고 공평하지않다는말도하곸ㅋㅋㅋㅋㅋㅋㅋㅋ근데 오히려 외국팬들이 뉴질랜드에서 촬영한거고 잼리랑 로얄패밀리 수장 패리스고블이 커스틴이랑 선긋는거에 대해서 불만재기하던데 왜 한국인들만 한국탓 한국이 잘못이오 하는거냐 팩트체크도 안하고 그리고 무슨 아카넨이랑 커스틴이 너무 유명해서 스우파 나와서 이런 취급받을애들이 아니다 하는데 오히려 얻어간게 더 많아 커스틴도 아무리 잼리퍼블릭에 댄서로서 유명했어도 인스타 팔로워 40만도 안됐었어 일본도 엔터산업 썩은거 모름? 츠바킬 댄서들 원래부터 틱톡에 kpop 댄스 올리고 그랫는데 다 한국방송나온이유가있음 라트리스도 중국방송도 나왔었고 저스트절크댄스학원에서 강사도 햇을껄
스우파,효진초이 영상보고 생각나는건데 스우파1 리더끼리 한팀 스우파2리더끼리 한팀 되어서 배틀하면 개재미있을듯 올스타전 제발
스우파,애들아 스우파2 메가크루 어땠음??
스우파,"딥앤댑은 초등학교 때 췄던 부채춤 생각나는 동선임,, 국뽕 자극하는 한국무용 졸업작품 느낌인데 다들 극찬하니깐 당혹스러움,, 메가크루 미션은 원밀이 압살임,, 잼이 여건상 불리했던것 빼면 다른 팀들도 다 잘했는데 베베는 ㅜㅜ 카메라 보고 인상쓰는 것 좀 그만했으면 좋겠음,, 바다도 은근 자기복제 심함,, 춤은 안보이고 머리에 손 올리고 인상쓰는것 밖에 생각 안남.. k팝 미션에도 썼던 발 매다는거랑 이미 스맨파 스우파에서 자주 나오는 뒤로 넘어가는 테크닉을 베베가 또 보여주니깐 개진부했음"
스우파,베베는 바다 원툴 팀인거 드러난듯 스우파1 웨이비 노제원툴처럼
스우파,뷔줌마들 글을 몇개나 처올리는거야? 이래도 조회수 스우파보다 안나오는거 애잔
스우파,너네 스우파에서 호감 비호감 누구임?
스우파, 놉 카프리 ㅈㄴ 조아 레이디바운스 팀 자체가 좋음 뭔가 스우파 나오려고 급조한 팀이 아니어서 더 호감임
스우파,같이 춤 추는것도 아니고 중간에 5초 나와서 얼굴 비추고 나가던데진짜 퍼포 자체도 조회수용으로 아이돌 불렀다고 어그로 끌리기 딱 좋게 짜놓음…아니 진짜 왜..???차라리 아예 댄서로 참여 시키던가스우파1이나 스맨파는 아이돌도 다 춤 추고 퍼포 참여했는데ㅜ왜지..? 
스우파,안무구성이 가독성 좋은데 유치하지 않고 변화가 많은데 난잡하지 않으면서 핵심포인트 싹다 뇌리에 박아짐 원밀 이정도면 스우파 메가크루 하려고 나온거 아니냐고ㅋㅋ
스우파,"스우파 딥앤댑 멤버 카이스트 뭐임,,???"
스우파,"스우파2 출연자 나무위키 한명씩 슥슥 보다가 개놀랐네간지난다,,,,,"
스우파,스우파 개미쳤다 ㄹㅇ
스우파,스우파2 바다 지대 간지 ;
스우파,갑자기 바다 악플 늘어난 이유:바다가 키가 커서 키작남들의 열등감 건드림╋스우파2에 일뽕 많은데 츠바킬이 베베한테 져서 떨어지니까 억지부리는 거
시즌룩,전부 발렌시아가 뉴 시즌룩이라고 하네발렌시아가 엠버 할 예정 막내인 줄 알았더니 남자미 뿜뿜 
십여,시간 십여년 흘러서 팬들 다 떠났다고 이제서야 응원해주는 분위기가 역겨워 ㅋㅋㅋ
쓰니님,엄마는... 강하답니다.앞으로 쓰니님 앞길 꽃길걸으시길.. 화이팅
아카넨,유튜브 스우파 공식채널 댓글 츠바킬 징징댓글로 뒤덮인거 진짜 소름이네그것도 그거고 잼리퍼블릭 메가 크루 미션 한국에서 찍어서 불리하다니 지원이 부족하니 어쩌고 저쩌고 공평하지않다는말도하곸ㅋㅋㅋㅋㅋㅋㅋㅋ근데 오히려 외국팬들이 뉴질랜드에서 촬영한거고 잼리랑 로얄패밀리 수장 패리스고블이 커스틴이랑 선긋는거에 대해서 불만재기하던데 왜 한국인들만 한국탓 한국이 잘못이오 하는거냐 팩트체크도 안하고 그리고 무슨 아카넨이랑 커스틴이 너무 유명해서 스우파 나와서 이런 취급받을애들이 아니다 하는데 오히려 얻어간게 더 많아 커스틴도 아무리 잼리퍼블릭에 댄서로서 유명했어도 인스타 팔로워 40만도 안됐었어 일본도 엔터산업 썩은거 모름? 츠바킬 댄서들 원래부터 틱톡에 kpop 댄스 올리고 그랫는데 다 한국방송나온이유가있음 라트리스도 중국방송도 나왔었고 저스트절크댄스학원에서 강사도 햇을껄
아카넨,나는 호감은바다 커스틴 츠바킬(레나 아카넨)비호감은 그 아줌마같이 생긴 욕심 개쩌는 팀ㅋㅋ싫음
억빠,억빠들 개짜증남ㅅㅂ 츠바킬 그냥 누가봐도 아쉽게 떨어진 크루로 사람들한테 아쉽지만 좋은 이미지러 남아있었는데 억빠들때문에 츠바킬 지금 떨어진게 낫다 이런말 나옴ㅅㅂ
얼굴합,근데 얼굴합 음색합 다 쩐다 이참에 듀엣 음원 가즈아!
엔시티곡,배기진스 듣고 완전 이수만이 픽했을 엔시티곡 같다고 생각했는ㄷ데
여쟈,저 여쟈 저렇게 키운 부모나 저여자 며느리로 들인 시부모나 데리고 사는 남편 등 주위 친인척들은요??  그밥에 그나물이죠?????? 와…………………
